url,Product Name,Price,Description,Feature Image,Rating
https://www.amazon.com/Skytech-Legacy-Gaming-Desktop-NVIDIA/dp/B0F5B83ZC8/ref=sr_1_131?dib=eyJ2IjoiMSJ9.qcIX2P8lHXlVzH59WP37vtDyBnxYfUvXh0H6F-kKFXFSYUHbvuepF9HHTW8W1EvINNGgCTWXyl1aoa2flbo6qsw-JUegZCKDYEdSwxjzDCziQuPi9sJu3Z_zaXtYxh0iuSPAkQqyhPZhNqAYA_HDn4Ff-Sc47ARc6EPjydmC98Avdu95HJFU_wPkAJqq3sif1MTczXMPfb2th3mcKX43O7TTwghRwOPj87v8cGLWygM.iLA-6nUnRoY8wYsQ1TFTj6LLYoTxPEjae8YLhAsdBEI&dib_tag=se&keywords=NVIDIA+RTX+5090&qid=1756534473&sr=8-131,"Skytech Legacy 4 Gaming PC Desktop, Ultra 9 285K 3.7 GHz(5.7 GHz Turbo), NVIDIA RTX 5090 32GB, Z890 Board, 4TB Gen4 NVMe SSD, 64GB DDR5 RAM 6000 RGB, 1200W Gold ATX 3 PSU, Wi-Fi, Win 11","4,849","['Intel Intel Core Ultra 9 U9 285K 3.7GHz (5.5GHz Turbo Boost) CPU Processor | 4TB Gen4 NVMe M.2 SSD – Up to 30x Faster Than Traditional HDD | 420mm AIO Liquid CPU Cooler with ARGB Fans, say goodbye to outdated and inefficient air coolers.', 'NVIDIA Geforce RTX 5090 32GB GDDR7 Graphics Card (Brand may vary) | 64GB DDR5 RAM 6000 RGB Gaming Memory with Heat Spreader | Windows 11 Home 64-bit', '802.11 AC | No Bloatware | Graphic output options include 1 x HDMI, and 1 x Display Port Promised, Additional Ports may vary | USB Ports Including 2.0, 3.0, and 3.2 Gen1 Ports | HD Audio & Mic | Free Gaming Keyboard & Mouse', ""High-spec AIO liquid coolers used, delivering unmatched cooling performance for a perfect operational experience and unparalleled cooling performance. With hardware unrestricted by temperature limits, you can unleash its full potential. Whether gaming, creating, or working, you'll never suffer from thermal throttling again. | Skytech Legacy Gaming Case with Tempered Glass, White | 1 Year Warranty on Parts and Labor | Free Technical Support | Assembled in the USA"", 'This powerful gaming PC is capable of running all your favorite games such as Call of Duty, Fortnite, Escape from Tarkov, Grand Theft Auto V, Valorant, World of Warcraft, League of Legends, Apex Legends, PLAYERUNKNOWN’s Battlegrounds, Overwatch 2, Counter-Strike 2, Battlefield V, Minecraft, ELDEN RING Shadow of the Erdtree, Rocket League, Baldur’s Gate 3, Dota 2, HELLDIVERS 2, Monster Hunter, Terraria, Rainbow Six Siege, Dragon’s Dogma 2, Black Myth Wukong, Marvel Rivals, more at Ultra settings, detailed 4K Ultra HD resolution, and smooth 60+ FPS gameplay.']",https://m.media-amazon.com/images/I/81GaUPtGiEL._AC_SX679_.jpg,N/A
https://www.amazon.com/Nvidia-RTX-3090-TI-Founders/dp/B09X4JVZB5/ref=sr_1_132?dib=eyJ2IjoiMSJ9.qcIX2P8lHXlVzH59WP37vtDyBnxYfUvXh0H6F-kKFXFSYUHbvuepF9HHTW8W1EvINNGgCTWXyl1aoa2flbo6qsw-JUegZCKDYEdSwxjzDCziQuPi9sJu3Z_zaXtYxh0iuSPAkQqyhPZhNqAYA_HDn4Ff-Sc47ARc6EPjydmC98Avdu95HJFU_wPkAJqq3sif1MTczXMPfb2th3mcKX43O7TTwghRwOPj87v8cGLWygM.iLA-6nUnRoY8wYsQ1TFTj6LLYoTxPEjae8YLhAsdBEI&dib_tag=se&keywords=NVIDIA+RTX+5090&qid=1756534473&sr=8-132,nVidia GeForce RTX 3090 Ti Founders Edition,"1,946",['900-1G136-2505-000'],https://m.media-amazon.com/images/I/51K36OrmxLL._AC_SX679_.jpg,4.3
https://www.amazon.com/CyberPowerPC-Supreme-GeForce-Windows-SLCAI15000A2/dp/B0DW46D21Z/ref=sr_1_133?dib=eyJ2IjoiMSJ9.qcIX2P8lHXlVzH59WP37vtDyBnxYfUvXh0H6F-kKFXFSYUHbvuepF9HHTW8W1EvINNGgCTWXyl1aoa2flbo6qsw-JUegZCKDYEdSwxjzDCziQuPi9sJu3Z_zaXtYxh0iuSPAkQqyhPZhNqAYA_HDn4Ff-Sc47ARc6EPjydmC98Avdu95HJFU_wPkAJqq3sif1MTczXMPfb2th3mcKX43O7TTwghRwOPj87v8cGLWygM.iLA-6nUnRoY8wYsQ1TFTj6LLYoTxPEjae8YLhAsdBEI&dib_tag=se&keywords=NVIDIA+RTX+5090&qid=1756534473&sr=8-133,"CyberPowerPC Gamer Supreme Gaming PC, AMD Ryzen 9 9950X 4.3GHz, GeForce RTX 5090 32GB, 64GB DDR5, 4TB PCIe Gen4 SSD, WiFi Ready & Windows 11 Home (SLCAI15000A2)","5,099","['System: AMD Ryzen 9 9950X 4.3GHz 16 Cores | AMD B850 Chipset | 64GB DDR5 6000MHz | 4TB PCIe 4.0 NVMe SSD | Windows 11 Home', 'Graphics: NVIDIA GeForce RTX 5090 32GB Graphics | 1x HDMI | 3x DisplayPort', 'Connectivity: 2 x USB-C 3.1 | 4 x USB-A 3.1 | 2 x USB-A 2.0 | 1 x LAN | WiFi 6 | Bluetooth 5.3 | 7.1 Channel Audio', 'Liquid Cool CPU | Tempered Side Case Panel | Custom RGB Lighting | Keyboard and Mouse', '1 Year Parts & Labor Warranty, Free Lifetime Tech Support']",https://m.media-amazon.com/images/I/71Lype2hjqL._AC_SX679_.jpg,N/A
https://www.amazon.com/Corsair-Vengeance-i8300-Gaming-Dominator/dp/B0F8WB52V8/ref=sr_1_134?dib=eyJ2IjoiMSJ9.qcIX2P8lHXlVzH59WP37vtDyBnxYfUvXh0H6F-kKFXFSYUHbvuepF9HHTW8W1EvINNGgCTWXyl1aoa2flbo6qsw-JUegZCKDYEdSwxjzDCziQuPi9sJu3Z_zaXtYxh0iuSPAkQqyhPZhNqAYA_HDn4Ff-Sc47ARc6EPjydmC98Avdu95HJFU_wPkAJqq3sif1MTczXMPfb2th3mcKX43O7TTwghRwOPj87v8cGLWygM.iLA-6nUnRoY8wYsQ1TFTj6LLYoTxPEjae8YLhAsdBEI&dib_tag=se&keywords=NVIDIA+RTX+5090&qid=1756534473&sr=8-134,"Corsair Vengeance i8300 Gaming PC – Liquid Cooled Intel® Core™ Ultra 9 285K, NVIDIA® GeForce RTX™ 5090 GPU, 64GB Dominator Titanium RGB DDR5 Memory, 2+4TB M.2 SSD – Black","6,499","['GeForce RTX 50 Series Graphics Card: Powered by NVIDIA Blackwell, GeForce RTX 50 Series GPUs bring game-changing AI capabilities to gamers and creators. Multiply performance with NVIDIA DLSS 4, generate images at unprecedented speed, and unleash your creativity with NVIDIA Studio.', 'Liquid-cooled Intel Core Ultra processor: Offers a next-gen AI PC experience, delivering ultra-smooth gameplay, improved power efficiency, enhanced streaming and gaming performance, and increased multi-threading capabilities to achieve new levels of productivity.', 'CORSAIR DOMINATOR TITANIUM RGB DDR5 Memory: Boasts 11 individually addressable LEDs to illuminate your PC with spectacular customizable lighting.', 'Show Off Your System: Brilliant system-wide RGB lighting lets you create synchronized light shows with pre-installed signature lighting profiles, your own custom-created profiles, or integrated lighting that dynamically reacts to the game in real-time when playing select titles.', 'A Modern Case: Built into a roomy CORSAIR 5000T mid-tower ATX case, with easy cable management, a high-airflow front panel, and a stunning tempered glass side panel to show off your RGB lighting.']",https://m.media-amazon.com/images/I/81qIAJpkH7L._AC_SX679_.jpg,N/A
https://www.amazon.com/GIGABYTE-GeForce-5070-Gaming-Graphics/dp/B0DTGNTQ3C/ref=sr_1_135?dib=eyJ2IjoiMSJ9.qcIX2P8lHXlVzH59WP37vtDyBnxYfUvXh0H6F-kKFXFSYUHbvuepF9HHTW8W1EvINNGgCTWXyl1aoa2flbo6qsw-JUegZCKDYEdSwxjzDCziQuPi9sJu3Z_zaXtYxh0iuSPAkQqyhPZhNqAYA_HDn4Ff-Sc47ARc6EPjydmC98Avdu95HJFU_wPkAJqq3sif1MTczXMPfb2th3mcKX43O7TTwghRwOPj87v8cGLWygM.iLA-6nUnRoY8wYsQ1TFTj6LLYoTxPEjae8YLhAsdBEI&dib_tag=se&keywords=NVIDIA+RTX+5090&qid=1756534473&sr=8-135,"GIGABYTE GeForce RTX 5070 Gaming OC 12G Graphics Card - 12GB GDDR7, 192 Bits, PCI-E 5.0, 2625 MHz Core Clock, 3 x DP 2.1a, 1 x HDMI 2.1b, NVIDIA DLSS 4, GV-N5070GAMING OC-12GD",659,"['Equipped with GeForce RTX 5070 chipset', 'Integrated with 12GB 192-bit GDDR7 memory interface', 'WINDFORCE Cooling System', 'Halo RGB', 'Dual BIOS (Performance / Quiet)', 'Reinforced structure and versatile VGA stand', '4 year warranty (online registration required)']",https://m.media-amazon.com/images/I/81AHWRRuBCL._AC_SX679_.jpg,3.9
https://www.amazon.com/Alphacool-Geforce-Epic-X-Water-Backplate/dp/B0FBTJYFBL/ref=sr_1_136?dib=eyJ2IjoiMSJ9.qcIX2P8lHXlVzH59WP37vtDyBnxYfUvXh0H6F-kKFXFSYUHbvuepF9HHTW8W1EvINNGgCTWXyl1aoa2flbo6qsw-JUegZCKDYEdSwxjzDCziQuPi9sJu3Z_zaXtYxh0iuSPAkQqyhPZhNqAYA_HDn4Ff-Sc47ARc6EPjydmC98Avdu95HJFU_wPkAJqq3sif1MTczXMPfb2th3mcKX43O7TTwghRwOPj87v8cGLWygM.iLA-6nUnRoY8wYsQ1TFTj6LLYoTxPEjae8YLhAsdBEI&dib_tag=se&keywords=NVIDIA+RTX+5090&qid=1756534473&sr=8-136,Alphacool Core Geforce RTX 5090 Epic-X GPU Water Block with Backplate,339,"['Water block for the GeForce RTX 5090 Epic-X graphics card', 'Material: chromed copper and acrylic', 'Backplate included', 'Dimension: 218.40 x 148.57 x 34.38mm']",https://m.media-amazon.com/images/I/61qUzpNZShL._SX522_.jpg,N/A
https://www.amazon.com/ZOTAC-Graphics-IceStorm-Lighting-ZT-B50620F-10M/dp/B0F58S445K/ref=sr_1_137?dib=eyJ2IjoiMSJ9.qcIX2P8lHXlVzH59WP37vtDyBnxYfUvXh0H6F-kKFXFSYUHbvuepF9HHTW8W1EvINNGgCTWXyl1aoa2flbo6qsw-JUegZCKDYEdSwxjzDCziQuPi9sJu3Z_zaXtYxh0iuSPAkQqyhPZhNqAYA_HDn4Ff-Sc47ARc6EPjydmC98Avdu95HJFU_wPkAJqq3sif1MTczXMPfb2th3mcKX43O7TTwghRwOPj87v8cGLWygM.iLA-6nUnRoY8wYsQ1TFTj6LLYoTxPEjae8YLhAsdBEI&dib_tag=se&keywords=NVIDIA+RTX+5090&qid=1756534473&sr=8-137,"ZOTAC Gaming GeForce RTX 5060 Ti 16GB AMP DLSS 4 16GB GDDR7 128-bit 28 Gbps PCIE 5.0 Gaming Graphics Card, IceStorm 2.0 Cooling, White LED Lighting, ZT-B50620F-10M",489,"['Powered by the NVIDIA Blackwell architecture and DLSS 4', 'SFF-ready compact card, 2-slot, 16GB GDDR7, 128-bit, 28 Gbps, PCIE 5.0, Boost Clock 2632 MHz', 'IceStorm 2.0 Cooling, 2x 90mm BladeLink fans, Composite Heatpipes, Pass-thru Airflow Design, FREEZE Fan Stop', 'Metal Backplate, White LED Lighting, 8-pin PCIe power connector', '3 x DisplayPort 2.1b, 1 x HDMI 2.1b, 8K Ready, 4 Display Ready, HDCP 2.3, VR Ready']",https://m.media-amazon.com/images/I/71UpHfma32L.__AC_SY300_SX300_QL70_FMwebp_.jpg,4.5
https://www.amazon.com/GIGABYTE-Graphics-WINDFORCE-GV-N506TAERO-OC-16GD/dp/B0F5BCCKY6/ref=sr_1_138?dib=eyJ2IjoiMSJ9.qcIX2P8lHXlVzH59WP37vtDyBnxYfUvXh0H6F-kKFXFSYUHbvuepF9HHTW8W1EvINNGgCTWXyl1aoa2flbo6qsw-JUegZCKDYEdSwxjzDCziQuPi9sJu3Z_zaXtYxh0iuSPAkQqyhPZhNqAYA_HDn4Ff-Sc47ARc6EPjydmC98Avdu95HJFU_wPkAJqq3sif1MTczXMPfb2th3mcKX43O7TTwghRwOPj87v8cGLWygM.iLA-6nUnRoY8wYsQ1TFTj6LLYoTxPEjae8YLhAsdBEI&dib_tag=se&keywords=NVIDIA+RTX+5090&qid=1756534473&sr=8-138,"GIGABYTE GeForce RTX 5060 Ti AERO OC 16G Graphics Card, 16GB 128-bit GDDR7, PCIe 5.0, WINDFORCE Cooling System, GV-N506TAERO OC-16GD Video Card",539,"['Powered by the NVIDIA Blackwell architecture and DLSS 4', 'Powered by GeForce RTX 5060 Ti', 'Integrated with 16GB GDDR7 128bit memory interface', 'PCIe 5.0']",https://m.media-amazon.com/images/I/71mwBq9r4DL._AC_SX679_.jpg,4.5
https://www.amazon.com/MSI-Graphics-256-bit-Extreme-Performance/dp/B0DSXJ5QF4/ref=sr_1_139?dib=eyJ2IjoiMSJ9.qcIX2P8lHXlVzH59WP37vtDyBnxYfUvXh0H6F-kKFXFSYUHbvuepF9HHTW8W1EvINNGgCTWXyl1aoa2flbo6qsw-JUegZCKDYEdSwxjzDCziQuPi9sJu3Z_zaXtYxh0iuSPAkQqyhPZhNqAYA_HDn4Ff-Sc47ARc6EPjydmC98Avdu95HJFU_wPkAJqq3sif1MTczXMPfb2th3mcKX43O7TTwghRwOPj87v8cGLWygM.iLA-6nUnRoY8wYsQ1TFTj6LLYoTxPEjae8YLhAsdBEI&dib_tag=se&keywords=NVIDIA+RTX+5090&qid=1756534473&sr=8-139,"MSI Gaming RTX 5080 16G SUPRIM SOC Graphics Card (16GB GDDR7, 256-bit, Extreme Performance: 2760 MHz, DisplayPort x 3 2.1a, HDMI 2.1b, NVIDIA Blackwell Architecture)","1,409","['Chipset: NVIDIA GeForce RTX 5080', 'Video Memory: 16 GB GDDR7', 'Memory Interface: 256-bit', 'Output: DisplayPort x 3 (v2.1a) / HDMI 2.1b x 1', 'Digital maximum resolution: 7680 x 4320']",https://m.media-amazon.com/images/I/71hVE3eq1bL._AC_SX679_.jpg,5.0
https://www.amazon.com/MSI-Vanguard-DisplayPort-Blackwell-Architecture/dp/B0DSWP51N3/ref=sr_1_140?dib=eyJ2IjoiMSJ9.qcIX2P8lHXlVzH59WP37vtDyBnxYfUvXh0H6F-kKFXFSYUHbvuepF9HHTW8W1EvINNGgCTWXyl1aoa2flbo6qsw-JUegZCKDYEdSwxjzDCziQuPi9sJu3Z_zaXtYxh0iuSPAkQqyhPZhNqAYA_HDn4Ff-Sc47ARc6EPjydmC98Avdu95HJFU_wPkAJqq3sif1MTczXMPfb2th3mcKX43O7TTwghRwOPj87v8cGLWygM.iLA-6nUnRoY8wYsQ1TFTj6LLYoTxPEjae8YLhAsdBEI&dib_tag=se&keywords=NVIDIA+RTX+5090&qid=1756534473&sr=8-140,"MSI Gaming RTX 5080 16G Vanguard SOC Graphics Card (16GB GDDR7, 256-bit, Extreme Clock TBD MHz, DisplayPort x 3 2.1a, HDMI 2.1b, NVIDIA Blackwell Architecture)","1,389","['Chipset: NVIDIA GeForce RTX 5080', 'Video Memory: 16 GB GDDR7', 'Memory Interface: 256-bit', 'Output: DisplayPort x 3 (v2.1a) / HDMI 2.1b x 1', 'Digital maximum resolution: 7680 x 4320']",https://m.media-amazon.com/images/I/71pe3BuV5pL._AC_SX679_.jpg,4.7
https://www.amazon.com/Skytech-Gaming-Legacy-Desktop-9950X3D/dp/B0FNMKT8VD/ref=sr_1_141?dib=eyJ2IjoiMSJ9.qcIX2P8lHXlVzH59WP37vtDyBnxYfUvXh0H6F-kKFXFSYUHbvuepF9HHTW8W1EvINNGgCTWXyl1aoa2flbo6qsw-JUegZCKDYEdSwxjzDCziQuPi9sJu3Z_zaXtYxh0iuSPAkQqyhPZhNqAYA_HDn4Ff-Sc47ARc6EPjydmC98Avdu95HJFU_wPkAJqq3sif1MTczXMPfb2th3mcKX43O7TTwghRwOPj87v8cGLWygM.iLA-6nUnRoY8wYsQ1TFTj6LLYoTxPEjae8YLhAsdBEI&dib_tag=se&keywords=NVIDIA+RTX+5090&qid=1756534473&sr=8-141,"Skytech Gaming Legacy 4 Desktop PC, Ryzen 9 9950X3D 4.3 GHz (5.7GHz), NVIDIA RTX 5090 32GB, X870 Board, 4TB Gen4 NVMe SSD, 64GB DDR5 RAM 5200 RGB, 1200W Gold ATX 3 PSU, 360mm ARGB AIO, Wi-Fi, Win 11","4,999","['AMD Ryzen 9 9950X3D 4.3GHz (5.7GHz Turbo Boost) CPU Processor | 4TB Gen4 NVMe M.2 SSD – Up to 30x Faster Than Traditional HDD | 360mm AIO Liquid CPU Cooler with ARGB Fans, say goodbye to outdated and inefficient air coolers.', 'NVIDIA GeForce RTX 5090 32GB GDDR7 Graphics Card (Brand may vary) | X870 motherboard delivers exceptional gaming and professional experiences.| 64GB DDR5 RAM 5200 RGB Gaming Memory with Heat Spreader | Windows 11 Home 64-bit', '802.11 AC | No Bloatware | Graphic output options include 1 x HDMI, and 1 x Display Port Promised, Additional Ports may vary | USB Ports Including 2.0, 3.0, and 3.2 Gen1 Ports | HD Audio & Mic | Free Gaming Keyboard & Mouse', ""High-spec AIO liquid coolers used, delivering unmatched cooling performance for a perfect operational experience and unparalleled cooling performance. With hardware unrestricted by temperature limits, you can unleash its full potential. Whether gaming, creating, or working, you'll never suffer from thermal throttling again. | Skytech Legacy Gaming Case with Tempered Glass, White | 1 Year Warranty on Parts and Labor | Free Technical Support | Assembled in the USA"", 'This powerful gaming PC is capable of running all your favorite games such as Call of Duty, Fortnite, Escape from Tarkov, Grand Theft Auto V, Valorant, World of Warcraft, League of Legends, Apex Legends, PLAYERUNKNOWN’s Battlegrounds, Overwatch 2, Counter-Strike 2, Battlefield V, Minecraft, ELDEN RING Shadow of the Erdtree, Rocket League, Baldur’s Gate 3, Dota 2, HELLDIVERS 2, Monster Hunter, Terraria, Rainbow Six Siege, Black Myth Wukong, Marvel Rivals, Stellar Blade, more at Ultra settings, detailed 4K Ultra HD resolution, and smooth 60+ FPS gameplay.']",https://m.media-amazon.com/images/I/71CMEqCJpML._AC_SX679_.jpg,N/A
https://www.amazon.com/MSI-Graphics-DisplayPort-Blackwell-Architecture/dp/B0DSWQNGYF/ref=sr_1_142?dib=eyJ2IjoiMSJ9.qcIX2P8lHXlVzH59WP37vtDyBnxYfUvXh0H6F-kKFXFSYUHbvuepF9HHTW8W1EvINNGgCTWXyl1aoa2flbo6qsw-JUegZCKDYEdSwxjzDCziQuPi9sJu3Z_zaXtYxh0iuSPAkQqyhPZhNqAYA_HDn4Ff-Sc47ARc6EPjydmC98Avdu95HJFU_wPkAJqq3sif1MTczXMPfb2th3mcKX43O7TTwghRwOPj87v8cGLWygM.iLA-6nUnRoY8wYsQ1TFTj6LLYoTxPEjae8YLhAsdBEI&dib_tag=se&keywords=NVIDIA+RTX+5090&qid=1756534473&sr=8-142,"MSI Gaming RTX 5080 16G Ventus 3X OC White Graphics Card (16GB GDDR7, 256-bit, Extreme Clock TBD MHz, DisplayPort x 3 2.1a, HDMI 2.1b, NVIDIA Blackwell Architecture)","1,449","['Chipset: NVIDIA GeForce RTX 5080', 'Video Memory: 16 GB GDDR7', 'Memory Interface: 256-bit', 'Output: DisplayPort x 3 (v2.1a) / HDMI 2.1b x 1', 'Digital maximum resolution: 7680 x 4320']",https://m.media-amazon.com/images/I/71s0L-D-LBL._AC_SX679_.jpg,5.0
https://www.amazon.com/Skytech-Gaming-Legacy-Desktop-14900K/dp/B0FFLTZNTP/ref=sr_1_143?dib=eyJ2IjoiMSJ9.qcIX2P8lHXlVzH59WP37vtDyBnxYfUvXh0H6F-kKFXFSYUHbvuepF9HHTW8W1EvINNGgCTWXyl1aoa2flbo6qsw-JUegZCKDYEdSwxjzDCziQuPi9sJu3Z_zaXtYxh0iuSPAkQqyhPZhNqAYA_HDn4Ff-Sc47ARc6EPjydmC98Avdu95HJFU_wPkAJqq3sif1MTczXMPfb2th3mcKX43O7TTwghRwOPj87v8cGLWygM.iLA-6nUnRoY8wYsQ1TFTj6LLYoTxPEjae8YLhAsdBEI&dib_tag=se&keywords=NVIDIA+RTX+5090&qid=1756534473&sr=8-143,"Skytech Gaming Legacy 4 Desktop PC, Intel i9 14900K 3.2 GHz (5.7GHz Turbo), NVIDIA RTX 5090 32GB, Z790 Board, 2TB Gen4 NVMe SSD, 64GB DDR5 RAM 6000, 1200W GOLD ATX 3 PSU, 420mm ARGB AIO, Wi-Fi, Win 11","5,749","['Intel Core i9 14900K 3.2GHz (5.7GHz Turbo Boost) CPU Processor | 2TB Gen4 NVMe M.2 SSD – Up to 30x Faster Than Traditional HDD | 420mm AIO Liquid CPU Cooler with ARGB Fans, say goodbye to outdated and inefficient air coolers.', 'NVIDIA GeForce RTX 5090 32GB GDDR7 Graphics Card (Brand may vary) | Z790 motherboard delivers exceptional gaming and professional experiences.| 64GB DDR5 RAM 6000 RGB Gaming Memory with Heat Spreader | Windows 11 Home 64-bit', '802.11 AC | No Bloatware | Graphic output options include 1 x HDMI, and 1 x Display Port Promised, Additional Ports may vary | USB Ports Including 2.0, 3.0, and 3.2 Gen1 Ports | HD Audio & Mic | Free Gaming Keyboard & Mouse', ""High-spec AIO liquid coolers used, delivering unmatched cooling performance for a perfect operational experience and unparalleled cooling performance. With hardware unrestricted by temperature limits, you can unleash its full potential. Whether gaming, creating, or working, you'll never suffer from thermal throttling again. | Skytech Legacy Gaming Case with Tempered Glass, White | 1 Year Warranty on Parts and Labor | Free Technical Support | Assembled in the USA"", 'This powerful gaming PC is capable of running all your favorite games such as Call of Duty, Fortnite, Escape from Tarkov, Grand Theft Auto V, Valorant, World of Warcraft, League of Legends, Apex Legends, PLAYERUNKNOWN’s Battlegrounds, Overwatch 2, Counter-Strike 2, Battlefield V, Minecraft, ELDEN RING Shadow of the Erdtree, Rocket League, Baldur’s Gate 3, Dota 2, HELLDIVERS 2, Monster Hunter, Terraria, Rainbow Six Siege, Black Myth Wukong, Marvel Rivals, Stellar Blade, more at Ultra settings, detailed 4K Ultra HD resolution, and smooth 60+ FPS gameplay.']",https://m.media-amazon.com/images/I/61KL3bcRfVL._AC_SX679_.jpg,N/A
https://www.amazon.com/Skytech-Gaming-Vision-Desktop-NVIDIA/dp/B0FNMN313Q/ref=sr_1_144?dib=eyJ2IjoiMSJ9.qcIX2P8lHXlVzH59WP37vtDyBnxYfUvXh0H6F-kKFXFSYUHbvuepF9HHTW8W1EvINNGgCTWXyl1aoa2flbo6qsw-JUegZCKDYEdSwxjzDCziQuPi9sJu3Z_zaXtYxh0iuSPAkQqyhPZhNqAYA_HDn4Ff-Sc47ARc6EPjydmC98Avdu95HJFU_wPkAJqq3sif1MTczXMPfb2th3mcKX43O7TTwghRwOPj87v8cGLWygM.iLA-6nUnRoY8wYsQ1TFTj6LLYoTxPEjae8YLhAsdBEI&dib_tag=se&keywords=NVIDIA+RTX+5090&qid=1756534473&sr=8-144,"Skytech Gaming O11 Vision Desktop PC, Intel Ultra 9 285K 3.7 GHz, NVIDIA RTX 5090 32GB, Z890 Board, 4TB Gen4 NVMe SSD, 64GB DDR5 RAM 5200 RGB, 1200W Gold ATX 3 PSU, 360mm ARGB AIO, Wi-Fi, Win 11","4,899","['Intel Core Ultra 9 U9 285K 3.7GHz (5.5GHz Turbo Boost) CPU Processor | 4TB Gen4 NVMe M.2 SSD – Up to 30x Faster Than Traditional HDD | 360mm AIO Liquid CPU Cooler with ARGB Fans, say goodbye to outdated and inefficient air coolers.', 'NVIDIA GeForce RTX 5090 32GB GDDR7 Graphics Card (Brand may vary) | Z890 motherboard delivers exceptional gaming and professional experiences.| 64GB DDR5 RAM 5200 RGB Gaming Memory with Heat Spreader | Windows 11 Home 64-bit', '802.11 AC | No Bloatware | Graphic output options include 1 x HDMI, and 1 x Display Port Promised, Additional Ports may vary | USB Ports Including 2.0, 3.0, and 3.2 Gen1 Ports | HD Audio & Mic | Free Gaming Keyboard & Mouse', ""High-spec AIO liquid coolers used, delivering unmatched cooling performance for a perfect operational experience and unparalleled cooling performance. With hardware unrestricted by temperature limits, you can unleash its full potential. Whether gaming, creating, or working, you'll never suffer from thermal throttling again. | Showcase Your PC with the Stunning Lian Li PC-O11 Vision Case - White | 1 Year Warranty on Parts and Labor | Free Technical Support | Assembled in the USA"", 'This powerful gaming PC is capable of running all your favorite games such as Call of Duty, Fortnite, Escape from Tarkov, Grand Theft Auto V, Valorant, World of Warcraft, League of Legends, Apex Legends, PLAYERUNKNOWN’s Battlegrounds, Overwatch 2, Counter-Strike 2, Battlefield V, Minecraft, ELDEN RING Shadow of the Erdtree, Rocket League, Baldur’s Gate 3, Dota 2, HELLDIVERS 2, Monster Hunter, Terraria, Rainbow Six Siege, Black Myth Wukong, Marvel Rivals, Stellar Blade, more at Ultra settings, detailed 4K Ultra HD resolution, and smooth 60+ FPS gameplay.']",https://m.media-amazon.com/images/I/71pFp+-67ZL._AC_SX679_.jpg,N/A
https://www.amazon.com/Razer-Blade-16-Gaming-Laptop/dp/B0DYLX9VQQ/ref=sr_1_145?dib=eyJ2IjoiMSJ9.qcIX2P8lHXlVzH59WP37vtDyBnxYfUvXh0H6F-kKFXFSYUHbvuepF9HHTW8W1EvINNGgCTWXyl1aoa2flbo6qsw-JUegZCKDYEdSwxjzDCziQuPi9sJu3Z_zaXtYxh0iuSPAkQqyhPZhNqAYA_HDn4Ff-Sc47ARc6EPjydmC98Avdu95HJFU_wPkAJqq3sif1MTczXMPfb2th3mcKX43O7TTwghRwOPj87v8cGLWygM.iLA-6nUnRoY8wYsQ1TFTj6LLYoTxPEjae8YLhAsdBEI&dib_tag=se&keywords=NVIDIA+RTX+5090&qid=1756534473&sr=8-145,Razer Blade 16 (2025) Gaming Laptop: NVIDIA GeForce RTX 5090 - AMD Ryzen AI 9 HX 370 CPU - QHD+ 240Hz OLED Display - 64GB LPDDR5x RAM - 4TB (2TB+2TB) SSD PCIe Gen4 - Windows 11 - Copilot+ PC - RGB,"3,769.","['ULTRA-THIN 14.9MM DESIGN — Featuring a new design, the Blade 16 is up to 30% smaller and 12% lighter for greater mobility and upgraded with an improved keyboard offering 1.5 mm of travel for more satisfying feedback', 'NVIDIA GEFORCE RTX 5090 LAPTOP GPU — Pushing up to 160 W TGP in a low profile chassis, get more raw performance per cubic-inch than any other 16 inch gaming laptop; paired with the AI power of NVIDIA DLSS 4, enjoy more high-quality frames in games', 'AMD RYZEN AI 9 HX 370 PROCESSOR — Armed with 12 cores / 24 threads of processing power and 50 TOPS of NPU performance, boost performance in AI-enabled applications and access the full suite of Copilot+ experiences to elevate productivity', 'FAST 16-INCH QHD+ 240 HZ OLED DISPLAY — Experience the best of both worlds with an incredibly low 2 ms response time for fast-paced action and a selection of professionally tuned Calman Verified color profiles for creating works of art', '64 GB 8000 MHZ LPDDR5X MEMORY — Operating at a 42% faster frequency than the previous generation, do more on this laptop than ever before, while getting greater efficiency and a thinner design for greater portability', 'THE BLADE ADVANTAGE — Precision-milled from a single block of aluminum to form a rigid unibody design, anodized for superior resilience, and packed with power, Razer Blades provide a truly one-of-a-kind experience']",https://m.media-amazon.com/images/I/814MWmHR66L._AC_SX679_.jpg,2.3
https://www.amazon.com/sspa/click?ie=UTF8&spc=MToxNTkwODk2MzYyOTUxNDQ6MTc1NjUzNDUxMzpzcF9hdGZfbmV4dDozMDA4MzQyNzYxODE1MDI6OjA6Og&url=%2FPNY-Overclocked-Graphics-3-5-Slot-Epic-XTM%2Fdp%2FB0DTJFSSZG%2Fref%3Dsr_1_145_sspa%3Fdib%3DeyJ2IjoiMSJ9.INhwSDyyX7BVmoU8ysZZcJv8Pi1PKpAadCm6Ybst-xmp5hMCF55KlRGBIisMerfIAstlkc17gLgT1ICQmcXhIDYxBsB5rSx8PKnNEFbHT61UENhrkUcoDBw16GwfhKLBloSM68iqJWlFLoEJwtOtrtxveuCq2pCaNymfxRSCC6MB9zSDkBO1OwwspZkv1p6aqWe7pmIJ1NWU3cjdt33zY6wJEpp-Z-5kwF4l3GSFzHQ.Xd3U3gbSfaakMsHDFGk9JiPeKfHDpuFOBWU8xYnSZVw%26dib_tag%3Dse%26keywords%3DNVIDIA%2BRTX%2B5090%26qid%3D1756534513%26sr%3D8-145-spons%26sp_csd%3Dd2lkZ2V0TmFtZT1zcF9hdGZfbmV4dA%26psc%3D1,"PNY NVIDIA GeForce RTX™ 5090 32GB ARGB Overclocked Triple Fan Graphics Card (DLSS 4, PCIe® 5.0, HDMI®/DP 2.1, 3.5-Slot, Epic-X™ RGB Lighting)","2,517","['NVIDIA DLSS 4 - Supreme Speed. Superior Visuals. Powered by AI. DLSS is a revolutionary suite of neural rendering technologies that uses AI to boost FPS, reduce latency, and improve image quality. \u200cThe latest breakthrough, DLSS 4, brings new Multi Frame Generation and enhanced Ray Reconstruction and Super Resolution, powered by GeForce RTX 50 Series GPUs and fifth-generation Tensor Cores. DLSS on GeForce RTX is the best way to play, backed by an NVIDIA AI supercomputer in the cloud constantly improving your PC’s gaming capabilities.', 'NVIDIA Reflex 2 - Compete at Warp Speed. Reflex technologies optimize the graphics pipeline for ultimate responsiveness, providing faster target acquisition, quicker reaction times, and improved aim precision in competitive games. Reflex 2 introduces Frame Warp (coming soon!), which further reduces latency based on the game’s latest mouse input.', 'RTX AI PCs - NVIDIA Powers the World’s AI. And Yours. Upgrade to advanced AI with NVIDIA GeForce RTX GPUs and accelerate your gaming, creating, productivity, and development. Thanks to built-in AI processors, you get world-leading AI technology powering your Windows PC.', 'Creators - Your Creative AI-dvantage. NVIDIA Studio is your creative advantage. GeForce RTX 50 Series GPUs unlock transformative performance in video editing, 3D rendering, and graphic design. Experience RTX accelerations in top creative apps, world-class NVIDIA Studio drivers engineered and continually updated to provide maximum stability, and a suite of exclusive tools that harness the power of RTX for AI-assisted creative workflows.']",https://m.media-amazon.com/images/I/61lmZjZXotL._AC_SX679_.jpg,4.2
https://www.amazon.com/MSI-Graphics-192-bit-Extreme-Performance/dp/B0DYGKHNM3/ref=sr_1_146?dib=eyJ2IjoiMSJ9.INhwSDyyX7BVmoU8ysZZcJv8Pi1PKpAadCm6Ybst-xmp5hMCF55KlRGBIisMerfIAstlkc17gLgT1ICQmcXhIDYxBsB5rSx8PKnNEFbHT61UENhrkUcoDBw16GwfhKLBloSM68iqJWlFLoEJwtOtrtxveuCq2pCaNymfxRSCC6MB9zSDkBO1OwwspZkv1p6aqWe7pmIJ1NWU3cjdt33zY6wJEpp-Z-5kwF4l3GSFzHQ.Xd3U3gbSfaakMsHDFGk9JiPeKfHDpuFOBWU8xYnSZVw&dib_tag=se&keywords=NVIDIA+RTX+5090&qid=1756534513&sr=8-146,"MSI Gaming RTX 5070 12G Shadow 3X OC Graphics Card (12GB GDDR7, 192-bit, Extreme Performance: 2557 MHz, DisplayPort x3 2.1a, HDMI 2.1b, NVIDIA Blackwell Architecture)",549,"['Powered by the NVIDIA Blackwell architecture and DLSS 4', 'TORX Fan 5.0: Fan blades linked by ring arcs work to stabilize and maintain high-pressure airflow', 'Nickel-plated Copper Baseplate: Heat from the GPU and memory is swiftly captured by a nickel-plated copper baseplate and transferred', 'Core Pipes feature a square design to maximize contact with the GPU baseplate for optimal thermal management', 'Reinforcing Backplate: The reinforcing backplate features an airflow vent that allows exhaust air to directly pass through']",https://m.media-amazon.com/images/I/71xTys3tfhL._AC_SX679_.jpg,4.1
