url,Product Name,Price,Description,Feature Image,Rating
https://www.amazon.com/MSI-Graphics-192-bit-Extreme-Performance/dp/B0DYG7KB27/ref=sr_1_43?dib=eyJ2IjoiMSJ9.-OfEDU8Vm-40lzzeI0Ec31X8G35jGCuPWK73o4u0cijMPadK9W6WJT5WK56a9hQsjTnKq9VEyNA74MWcVDaOjbZ_CzlreOpC4RXKbr_o6tpFN0YzPpLODGZt3CYlEjfJ82WK7A5b9jutMfHWDMVt8Uyvou4lA8f-iKhGAlboh-y3E3vH1nI38GSL_LPvo-IWH8Eyjx0uyNwnt6bMsm2zKd3xvNnxQa__uN5aXFd3ocY.Ikb2OIUBWpDn2L8rGcZ-Hw338-Mk1ZKQWz4HvtyjhPI&dib_tag=se&keywords=NVIDIA+RTX+5090&qid=1756534210&sr=8-43,"MSI Gaming RTX 5070 12G Ventus 3X OC Graphics Card (12GB GDDR7, 192-bit, Extreme Performance: 2557 MHz, DisplayPort x3 2.1a, HDMI 2.1b, NVIDIA Blackwell Architecture)",574,"['Powered by the NVIDIA Blackwell architecture and DLSS 4', 'TORX Fan 5.0: Fan blades linked by ring arcs work to stabilize and maintain high-pressure airflow', 'Nickel-plated Copper Baseplate: Heat from the GPU and memory is swiftly captured by a nickel-plated copper baseplate and transferred', 'Core Pipe feature a square design to maximize contact with the GPU baseplate for optimal thermal management', 'Metal Backplate: A sturdy metal backplate strengthens the graphics card while the airflow vent design reduces excess heat']",https://m.media-amazon.com/images/I/71pdLSkA4NL._AC_SX679_.jpg,4.4
https://www.amazon.com/MSI-RTX-5090-32G-Vanguard/dp/B0F6VVDLY4/ref=sr_1_44?dib=eyJ2IjoiMSJ9.-OfEDU8Vm-40lzzeI0Ec31X8G35jGCuPWK73o4u0cijMPadK9W6WJT5WK56a9hQsjTnKq9VEyNA74MWcVDaOjbZ_CzlreOpC4RXKbr_o6tpFN0YzPpLODGZt3CYlEjfJ82WK7A5b9jutMfHWDMVt8Uyvou4lA8f-iKhGAlboh-y3E3vH1nI38GSL_LPvo-IWH8Eyjx0uyNwnt6bMsm2zKd3xvNnxQa__uN5aXFd3ocY.Ikb2OIUBWpDn2L8rGcZ-Hw338-Mk1ZKQWz4HvtyjhPI&dib_tag=se&keywords=NVIDIA+RTX+5090&qid=1756534210&sr=8-44,"MSI Gaming RTX 5090 32G Vanguard SOC Graphics Card (32GB GDDR7, 512-bit, Extreme Performance: 2527 MHz, DisplayPort x3 2.1a, HDMI 2.1b. Bundle with Targus Dock Station and Backpack Alinware","3,499","['Chipset: NVIDIA GeForce RTX 5090', 'Video Memory: 32 GB GDDR7', 'Memory Interface: 512-bit', 'Output: DisplayPort x 3 (v2.1a) / HDMI 2.1b x 1', 'Digital maximum resolution: 7680 x 4320']",https://m.media-amazon.com/images/I/710l+xbKu9L._AC_SX679_.jpg,N/A
https://www.amazon.com/GIGABYTE-GeForce-WINDFORCE-Graphics-GV-N5070WF3-12GD/dp/B0F72TVCGF/ref=sr_1_45?dib=eyJ2IjoiMSJ9.-OfEDU8Vm-40lzzeI0Ec31X8G35jGCuPWK73o4u0cijMPadK9W6WJT5WK56a9hQsjTnKq9VEyNA74MWcVDaOjbZ_CzlreOpC4RXKbr_o6tpFN0YzPpLODGZt3CYlEjfJ82WK7A5b9jutMfHWDMVt8Uyvou4lA8f-iKhGAlboh-y3E3vH1nI38GSL_LPvo-IWH8Eyjx0uyNwnt6bMsm2zKd3xvNnxQa__uN5aXFd3ocY.Ikb2OIUBWpDn2L8rGcZ-Hw338-Mk1ZKQWz4HvtyjhPI&dib_tag=se&keywords=NVIDIA+RTX+5090&qid=1756534210&sr=8-45,"GIGABYTE GeForce RTX 5070 WINDFORCE SFF 12G Graphics Card, 12GB 256-bit GDDR7, PCIe 5.0, WINDFORCE Cooling System, GV-N5070WF3-12GD Video Card",549,"['Powered by the NVIDIA Blackwell architecture and DLSS 4', 'Powered by GeForce RTX 5070', 'Integrated with 12GB GDDR7 192bit memory interface', 'PCIe 5.0', 'NVIDIA SFF ready']",https://m.media-amazon.com/images/I/717XiRt+pOL._AC_SX679_.jpg,4.7
https://www.amazon.com/ASUS-Graphics-Axial-tech-MaxContact-phase-change/dp/B0F8LGTHJD/ref=sr_1_46?dib=eyJ2IjoiMSJ9.-OfEDU8Vm-40lzzeI0Ec31X8G35jGCuPWK73o4u0cijMPadK9W6WJT5WK56a9hQsjTnKq9VEyNA74MWcVDaOjbZ_CzlreOpC4RXKbr_o6tpFN0YzPpLODGZt3CYlEjfJ82WK7A5b9jutMfHWDMVt8Uyvou4lA8f-iKhGAlboh-y3E3vH1nI38GSL_LPvo-IWH8Eyjx0uyNwnt6bMsm2zKd3xvNnxQa__uN5aXFd3ocY.Ikb2OIUBWpDn2L8rGcZ-Hw338-Mk1ZKQWz4HvtyjhPI&dib_tag=se&keywords=NVIDIA+RTX+5090&qid=1756534210&sr=8-46,"ASUS ROG Strix GeForce RTX 5070 Ti OC Edition 16GB GDDR7 Graphics Card (PCIe 5.0, HDMI/DP 2.1, 3.2-slot, Axial-tech fans, MaxContact design with vapor chamber, phase-change GPU thermal pad, aura sync)","1,079","['AI Performance: 1492 AI TOPS. GPU Tweak III software provides intuitive performance tweaking, advanced thermal control, and system monitoring', 'OC Edition: 2625 MHz OC mode, 2602 MHz default mode', '3.2-slot design: massive fin array optimized for airflow from the three Axial-tech fans', 'Axial-tech fans have been scaled up to propel more air through the card to reach higher performance', '0dB technology lets you enjoy light gaming in relative silence', 'MaxContact design with vapor chamber ensures efficient heat transfer, providing a premium performance', 'Phase-change GPU thermal pad helps ensure optimal heat transfer, lowering GPU temperatures for enhanced performance and reliability']",https://m.media-amazon.com/images/I/81tYKg1osaL._AC_SX679_.jpg,4.6
https://www.amazon.com/MSI-Graphics-DisplayPort-Blackwell-Architecture/dp/B0DSX9Y24P/ref=sr_1_47?dib=eyJ2IjoiMSJ9.-OfEDU8Vm-40lzzeI0Ec31X8G35jGCuPWK73o4u0cijMPadK9W6WJT5WK56a9hQsjTnKq9VEyNA74MWcVDaOjbZ_CzlreOpC4RXKbr_o6tpFN0YzPpLODGZt3CYlEjfJ82WK7A5b9jutMfHWDMVt8Uyvou4lA8f-iKhGAlboh-y3E3vH1nI38GSL_LPvo-IWH8Eyjx0uyNwnt6bMsm2zKd3xvNnxQa__uN5aXFd3ocY.Ikb2OIUBWpDn2L8rGcZ-Hw338-Mk1ZKQWz4HvtyjhPI&dib_tag=se&keywords=NVIDIA+RTX+5090&qid=1756534210&sr=8-47,"MSI Gaming RTX 5080 16G Inspire 3X OC Graphics Card (16GB GDDR7, 256-bit, Extreme Clock TBD MHz, DisplayPort x 3 2.1a, HDMI 2.1b, NVIDIA Blackwell Architecture)","1,189","['Chipset: NVIDIA GeForce RTX 5080', 'Video Memory: 16 GB GDDR7', 'Memory Interface: 256-bit', 'Output: DisplayPort x 3 (v2.1a) / HDMI 2.1b x 1', 'Digital maximum resolution: 7680 x 4320']",https://m.media-amazon.com/images/I/7140jUPvVCL._AC_SX679_.jpg,5.0
https://www.amazon.com/GIGABYTE-REV2-0-WINDFORCE-GV-N3060GAMING-OC-12GD/dp/B0971BG25M/ref=sr_1_48?dib=eyJ2IjoiMSJ9.-OfEDU8Vm-40lzzeI0Ec31X8G35jGCuPWK73o4u0cijMPadK9W6WJT5WK56a9hQsjTnKq9VEyNA74MWcVDaOjbZ_CzlreOpC4RXKbr_o6tpFN0YzPpLODGZt3CYlEjfJ82WK7A5b9jutMfHWDMVt8Uyvou4lA8f-iKhGAlboh-y3E3vH1nI38GSL_LPvo-IWH8Eyjx0uyNwnt6bMsm2zKd3xvNnxQa__uN5aXFd3ocY.Ikb2OIUBWpDn2L8rGcZ-Hw338-Mk1ZKQWz4HvtyjhPI&dib_tag=se&keywords=NVIDIA+RTX+5090&qid=1756534210&sr=8-48,"GIGABYTE GeForce RTX 3060 Gaming OC 12G (REV2.0) Graphics Card, 3X WINDFORCE Fans, 12GB 192-bit GDDR6, GV-N3060GAMING OC-12GD Video Card",349,"['NVIDIA Ampere Streaming Multiprocessors', '2nd Generation RT Cores', '3rd Generation Tensor Cores', 'Powered by GeForce RTX 3060.Avoid using unofficial software', 'Integrated with 12GB GDDR6 192-bit memory interface']",https://m.media-amazon.com/images/I/61XAtpgr1lL._AC_SX679_.jpg,4.7
https://www.amazon.com/Skytech-Legacy-Gaming-Desktop-9950X3D/dp/B0F214NJZT/ref=sr_1_49?dib=eyJ2IjoiMSJ9.-OfEDU8Vm-40lzzeI0Ec31X8G35jGCuPWK73o4u0cijMPadK9W6WJT5WK56a9hQsjTnKq9VEyNA74MWcVDaOjbZ_CzlreOpC4RXKbr_o6tpFN0YzPpLODGZt3CYlEjfJ82WK7A5b9jutMfHWDMVt8Uyvou4lA8f-iKhGAlboh-y3E3vH1nI38GSL_LPvo-IWH8Eyjx0uyNwnt6bMsm2zKd3xvNnxQa__uN5aXFd3ocY.Ikb2OIUBWpDn2L8rGcZ-Hw338-Mk1ZKQWz4HvtyjhPI&dib_tag=se&keywords=NVIDIA+RTX+5090&qid=1756534210&sr=8-49,"Skytech Legacy 4 Gaming PC Desktop, Ryzen 9 9950X3D 4.3 GHz (5.7GHz Turbo), NVIDIA RTX 5090 32GB, X870 Board, 4TB Gen4 NVMe SSD, 64GB DDR5 RAM 6000 RGB, 1200W Gold ATX 3 PSU, Wi-Fi, Win 11","4,699","['AMD Ryzen 9 9950X3D 4.3GHz (5.7GHz Turbo Boost) CPU Processor | 4TB Gen4 NVMe M.2 SSD – Up to 30x Faster Than Traditional HDD | 420mm AIO Liquid CPU Cooler with ARGB Fans, say goodbye to outdated and inefficient air coolers.', 'NVIDIA Geforce RTX 5090 32GB GDDR7 Graphics Card (Brand may vary) | 64GB DDR5 RAM 6000 RGB Gaming Memory with Heat Spreader | Windows 11 Home 64-bit', '802.11 AC | No Bloatware | Graphic output options include 1 x HDMI, and 1 x Display Port Promised, Additional Ports may vary | USB Ports Including 2.0, 3.0, and 3.2 Gen1 Ports | HD Audio and Mic | Free Gaming Keyboard and Mouse', ""High-spec AIO liquid coolers used, delivering unmatched cooling performance for a perfect operational experience and unparalleled cooling performance. With hardware unrestricted by temperature limits, you can unleash its full potential. Whether gaming, creating, or working, you'll never suffer from thermal throttling again. | Skytech Legacy Gaming Case with Tempered Glass, White | 1 Year Warranty on Parts and Labor | Free Technical Support | Assembled in the USA"", 'This powerful gaming PC is capable of running all your favorite games such as Call of Duty, Fortnite, Escape from Tarkov, Grand Theft Auto V, Valorant, World of Warcraft, League of Legends, Apex Legends, PLAYERUNKNOWN’s Battlegrounds, Overwatch 2, Counter-Strike 2, Battlefield V, Minecraft, ELDEN RING Shadow of the Erdtree, Rocket League, Baldur’s Gate 3, Dota 2, HELLDIVERS 2, Monster Hunter, Terraria, Rainbow Six Siege, Dragon’s Dogma 2, Black Myth Wukong, Marvel Rivals, more at Ultra settings, detailed 4K Ultra HD resolution, and smooth 60+ FPS gameplay.']",https://m.media-amazon.com/images/I/61KL3bcRfVL._AC_SX679_.jpg,5.0
https://www.amazon.com/sspa/click?ie=UTF8&spc=MTo1OTMyNDY5MjA5NjU1MTQzOjE3NTY1MzQyNTU6c3BfYXRmX25leHQ6MzAwODM0Mjc2MTgxNTAyOjowOjo&url=%2FPNY-Overclocked-Graphics-3-5-Slot-Epic-XTM%2Fdp%2FB0DTJFSSZG%2Fref%3Dsr_1_49_sspa%3Fdib%3DeyJ2IjoiMSJ9.5XzHLAjkfXSTc0tlFdefwB86rl_i9rL0wCdceHIH7XmJ5P-i22N31yluxfE-ifTW84Ky5hByGy0vXomgTNjwUZteaUVoVOnOr2RF4H-TNACqJcodvqdslVqtITxMa0LC5FVJJwx36CpszzsyS2q-oKlHeVvtOqom4Ul0YNShDBfN4pEO7lcaRMYU8arenmtm3DicXX7Mfp7ZUJj8iFWmKL5m2zGwZZcy6zC9eDU1EWA.MkKhkOEmaLF1RpzOKbitUJO_76rcSeJTyYGDlIl0GUE%26dib_tag%3Dse%26keywords%3DNVIDIA%2BRTX%2B5090%26qid%3D1756534255%26sr%3D8-49-spons%26sp_csd%3Dd2lkZ2V0TmFtZT1zcF9hdGZfbmV4dA%26psc%3D1,"PNY NVIDIA GeForce RTX™ 5090 32GB ARGB Overclocked Triple Fan Graphics Card (DLSS 4, PCIe® 5.0, HDMI®/DP 2.1, 3.5-Slot, Epic-X™ RGB Lighting)","2,517","['NVIDIA DLSS 4 - Supreme Speed. Superior Visuals. Powered by AI. DLSS is a revolutionary suite of neural rendering technologies that uses AI to boost FPS, reduce latency, and improve image quality. \u200cThe latest breakthrough, DLSS 4, brings new Multi Frame Generation and enhanced Ray Reconstruction and Super Resolution, powered by GeForce RTX 50 Series GPUs and fifth-generation Tensor Cores. DLSS on GeForce RTX is the best way to play, backed by an NVIDIA AI supercomputer in the cloud constantly improving your PC’s gaming capabilities.', 'NVIDIA Reflex 2 - Compete at Warp Speed. Reflex technologies optimize the graphics pipeline for ultimate responsiveness, providing faster target acquisition, quicker reaction times, and improved aim precision in competitive games. Reflex 2 introduces Frame Warp (coming soon!), which further reduces latency based on the game’s latest mouse input.', 'RTX AI PCs - NVIDIA Powers the World’s AI. And Yours. Upgrade to advanced AI with NVIDIA GeForce RTX GPUs and accelerate your gaming, creating, productivity, and development. Thanks to built-in AI processors, you get world-leading AI technology powering your Windows PC.', 'Creators - Your Creative AI-dvantage. NVIDIA Studio is your creative advantage. GeForce RTX 50 Series GPUs unlock transformative performance in video editing, 3D rendering, and graphic design. Experience RTX accelerations in top creative apps, world-class NVIDIA Studio drivers engineered and continually updated to provide maximum stability, and a suite of exclusive tools that harness the power of RTX for AI-assisted creative workflows.']",https://m.media-amazon.com/images/I/61lmZjZXotL._AC_SX679_.jpg,4.2
https://www.amazon.com/MSI-Graphics-192-bit-Extreme-Performance/dp/B0DYFXGDJF/ref=sr_1_50?dib=eyJ2IjoiMSJ9.5XzHLAjkfXSTc0tlFdefwB86rl_i9rL0wCdceHIH7XmJ5P-i22N31yluxfE-ifTW84Ky5hByGy0vXomgTNjwUZteaUVoVOnOr2RF4H-TNACqJcodvqdslVqtITxMa0LC5FVJJwx36CpszzsyS2q-oKlHeVvtOqom4Ul0YNShDBfN4pEO7lcaRMYU8arenmtm3DicXX7Mfp7ZUJj8iFWmKL5m2zGwZZcy6zC9eDU1EWA.MkKhkOEmaLF1RpzOKbitUJO_76rcSeJTyYGDlIl0GUE&dib_tag=se&keywords=NVIDIA+RTX+5090&qid=1756534255&sr=8-50,"MSI RTX 5070 12G Gaming Trio OC Graphics Card (12GB GDDR7, 192-bit, Extreme Performance: 2625 MHz, DisplayPort x3 2.1a, HDMI 2.1b, NVIDIA Blackwell Architecture)",619,"['Powered by the NVIDIA Blackwell architecture and DLSS 4', 'TRI FROZR 4 Thermal Design: Upgraded fans, airflow control, and thermal design deliver superior cooling and quieter operation', 'STORMFORCE Fan: Seven fan blades, claw texturing, and a circular arc are designed for optimal airflow with minimal noise', 'Nickel-plated Copper Baseplate: Heat from the GPU and memory is swiftly captured by a nickel-plated copper baseplate and transferred', 'Core Pipes feature a square design to maximize contact with the GPU baseplate for optimal thermal management']",https://m.media-amazon.com/images/I/71vOVP+iFnL._AC_SX300_SY300_.jpg,4.6
https://www.amazon.com/Palit-GeForce-GameRock-Express-28000MHz/dp/B0DVGWLZYN/ref=sr_1_51?dib=eyJ2IjoiMSJ9.5XzHLAjkfXSTc0tlFdefwB86rl_i9rL0wCdceHIH7XmJ5P-i22N31yluxfE-ifTW84Ky5hByGy0vXomgTNjwUZteaUVoVOnOr2RF4H-TNACqJcodvqdslVqtITxMa0LC5FVJJwx36CpszzsyS2q-oKlHeVvtOqom4Ul0YNShDBfN4pEO7lcaRMYU8arenmtm3DicXX7Mfp7ZUJj8iFWmKL5m2zGwZZcy6zC9eDU1EWA.MkKhkOEmaLF1RpzOKbitUJO_76rcSeJTyYGDlIl0GUE&dib_tag=se&keywords=NVIDIA+RTX+5090&qid=1756534255&sr=8-51,GeForce RTX 5090 GameRock (32GB GDDR7/PCI Express 5.0/2407MHz/28000MHz),"3,539","['The Palit GameRock series combines stunning aesthetics with powerful performance.', 'Designed to dazzle and deliver, GameRock is perfect for gamers, creators, and AI enthusiasts.']",https://m.media-amazon.com/images/I/61OCzNt2oXL._AC_SX679_.jpg,4.1
https://www.amazon.com/ASUS-GeForce-Graphics-DisplayPort-TUF-RTX5090-32G-GAMING/dp/B0DTHW9MBH/ref=sr_1_52?dib=eyJ2IjoiMSJ9.5XzHLAjkfXSTc0tlFdefwB86rl_i9rL0wCdceHIH7XmJ5P-i22N31yluxfE-ifTW84Ky5hByGy0vXomgTNjwUZteaUVoVOnOr2RF4H-TNACqJcodvqdslVqtITxMa0LC5FVJJwx36CpszzsyS2q-oKlHeVvtOqom4Ul0YNShDBfN4pEO7lcaRMYU8arenmtm3DicXX7Mfp7ZUJj8iFWmKL5m2zGwZZcy6zC9eDU1EWA.MkKhkOEmaLF1RpzOKbitUJO_76rcSeJTyYGDlIl0GUE&dib_tag=se&keywords=NVIDIA+RTX+5090&qid=1756534255&sr=8-52,"ASUS TUF Gaming GeForce RTX 5090 32GB GDDR7 Gaming Graphics Card (Nvidia GeForce RTX5090, 3.6 Slot Design, PCIe 5.0, 2X HDMI 2.1b, 3X DisplayPort 2.1a, TUF-RTX5090-32G-GAMING)","3,178.","['Experience unmatched stability with this graphics card: military-grade components ensure rock-solid performance and longer life', 'This gaming graphics card is optimally protected: the PCB protective coating protects against short circuits caused by moisture, dust or dirt', 'The ASUS TUF RTX 5090 offers excellent cooling: the 36-slot design with solid fin arrangement is optimized for airflow with three axial tech fans', 'Benefit from optimal thermal performance with this RTX 5090: The Phase Change GPU thermal pad ensures optimal thermal performance and longevity', 'Secure your investment with this graphics card: ASUS GPU Guard and mount secure the GPU, reduce the risk of cracking and ensure a stable attachment']",https://m.media-amazon.com/images/I/81BE1H1w23L._AC_SX679_.jpg,4.4
https://www.amazon.com/GeForce-RTX-5090-32G-SOC/dp/B0DYK4FGLH/ref=sr_1_53?dib=eyJ2IjoiMSJ9.5XzHLAjkfXSTc0tlFdefwB86rl_i9rL0wCdceHIH7XmJ5P-i22N31yluxfE-ifTW84Ky5hByGy0vXomgTNjwUZteaUVoVOnOr2RF4H-TNACqJcodvqdslVqtITxMa0LC5FVJJwx36CpszzsyS2q-oKlHeVvtOqom4Ul0YNShDBfN4pEO7lcaRMYU8arenmtm3DicXX7Mfp7ZUJj8iFWmKL5m2zGwZZcy6zC9eDU1EWA.MkKhkOEmaLF1RpzOKbitUJO_76rcSeJTyYGDlIl0GUE&dib_tag=se&keywords=NVIDIA+RTX+5090&qid=1756534255&sr=8-53,MSI GeForce RTX 5090 32G Vanguard SOC Graphics Board VD8999,"2,499.",['W129163281'],https://m.media-amazon.com/images/I/71LnSVieIHL._AC_SX679_.jpg,4.2
https://www.amazon.com/Aivalas-Support-Graphics-Adjustable-Universal/dp/B0BPGJCLYR/ref=sr_1_54?dib=eyJ2IjoiMSJ9.5XzHLAjkfXSTc0tlFdefwB86rl_i9rL0wCdceHIH7XmJ5P-i22N31yluxfE-ifTW84Ky5hByGy0vXomgTNjwUZteaUVoVOnOr2RF4H-TNACqJcodvqdslVqtITxMa0LC5FVJJwx36CpszzsyS2q-oKlHeVvtOqom4Ul0YNShDBfN4pEO7lcaRMYU8arenmtm3DicXX7Mfp7ZUJj8iFWmKL5m2zGwZZcy6zC9eDU1EWA.MkKhkOEmaLF1RpzOKbitUJO_76rcSeJTyYGDlIl0GUE&dib_tag=se&keywords=NVIDIA+RTX+5090&qid=1756534255&sr=8-54,"GPU Support Bracket, Graphics Video Card Brace with Height Adjustable, Anti Sag Holder for Universal Graphics Card Sag, GPU Stand with Magnet and Rubber Pad (Black)",5,"['Does A Good Job of Preventing GPU Sag: The GPU support bracket can be used to avoid your graphics card from sagging or damaged due to the weight of the card. The appearance of our gpu stand is very unobtrusive and does not detract form the aesthetics of your computer.', 'Exquisite Workmanship: This video card support bracket is made of premium quality aluminum which is sturdy and not deformed, provides strong and long-lasting support to your VGA Card.', 'Magnetic Non Slip Base: Being magnetic, graphics card stand holder is able to stick to the PSU shrouds in cases and has a good degree of extensibility. The bit has rubber on the ends which adds a nice grip to where it’s placed, preventing any slippage.', 'Basic But Effective Solution: Simply twist the nut of anti sag bracket gpu to adjust height as you need, then place it between the case and your GPU Card. PLEASE make sure the minimum support height is 2-7/8” and the maximum support height 4-3/4”.', 'Wide Application: Adopt with height adjustment design, our graphics card support brace compatible with most kinds of chassis configurations (such as ATX, M-ATX, ITX chassis structure and so on), meets various user hosts.']",https://m.media-amazon.com/images/I/71H7BANd7nL._AC_SX679_.jpg,4.7
https://www.amazon.com/GIGABYTE-Graphics-WINDFORCE-GV-N5070GAMING-OC-12GD/dp/B0DTR3JK3Y/ref=sr_1_55?dib=eyJ2IjoiMSJ9.5XzHLAjkfXSTc0tlFdefwB86rl_i9rL0wCdceHIH7XmJ5P-i22N31yluxfE-ifTW84Ky5hByGy0vXomgTNjwUZteaUVoVOnOr2RF4H-TNACqJcodvqdslVqtITxMa0LC5FVJJwx36CpszzsyS2q-oKlHeVvtOqom4Ul0YNShDBfN4pEO7lcaRMYU8arenmtm3DicXX7Mfp7ZUJj8iFWmKL5m2zGwZZcy6zC9eDU1EWA.MkKhkOEmaLF1RpzOKbitUJO_76rcSeJTyYGDlIl0GUE&dib_tag=se&keywords=NVIDIA+RTX+5090&qid=1756534255&sr=8-55,"GIGABYTE GeForce RTX 5070 Gaming OC 12G Graphics Card, 12GB 192-bit GDDR7, PCIe 5.0, WINDFORCE Cooling System, GV-N5070GAMING OC-12GD Video Card",598,"['Powered by the NVIDIA Blackwell architecture and DLSS 4', 'Powered by GeForce RTX 5070', 'Integrated with 12GB GDDR7 192bit memory interface', 'PCIe 5.0', 'WINDFORCE cooling system']",https://m.media-amazon.com/images/I/718suf-wttL._AC_SX679_.jpg,4.7
https://www.amazon.com/Ventus-FeForce-5090-Express-Extreme/dp/B0F3JSBT9M/ref=sr_1_56?dib=eyJ2IjoiMSJ9.5XzHLAjkfXSTc0tlFdefwB86rl_i9rL0wCdceHIH7XmJ5P-i22N31yluxfE-ifTW84Ky5hByGy0vXomgTNjwUZteaUVoVOnOr2RF4H-TNACqJcodvqdslVqtITxMa0LC5FVJJwx36CpszzsyS2q-oKlHeVvtOqom4Ul0YNShDBfN4pEO7lcaRMYU8arenmtm3DicXX7Mfp7ZUJj8iFWmKL5m2zGwZZcy6zC9eDU1EWA.MkKhkOEmaLF1RpzOKbitUJO_76rcSeJTyYGDlIl0GUE&dib_tag=se&keywords=NVIDIA+RTX+5090&qid=1756534255&sr=8-56,"MSI Ventus 3X FeForce RTX 5090 OC Edition 32 GB GDDR7, PCI Express Gen 5, Core Clocks Extreme: 2452 MHz, CUDA CORES 21760 Units, Memory Speed 28 Gbps, Bundle with HDMI Cable","2,954","['GeForce RTX 5090 32G VENTUS 3X OC', 'Graphics Processing Unit: NVIDIA GeForce RTX 5090', 'Interface: PCI Express Gen 5', 'Core Clocks: Extreme Performance: 2452 MHz (MSI Center). Boost: 2437 MHz', 'CUDA CORES: 21760 Units']",https://m.media-amazon.com/images/I/61V59GLHBHL._AC_SX679_.jpg,1.0
https://www.amazon.com/NVIDIA-GeForce-GDDR7-Graphics-Graphite/dp/B0F7XHBT13/ref=sr_1_57?dib=eyJ2IjoiMSJ9.5XzHLAjkfXSTc0tlFdefwB86rl_i9rL0wCdceHIH7XmJ5P-i22N31yluxfE-ifTW84Ky5hByGy0vXomgTNjwUZteaUVoVOnOr2RF4H-TNACqJcodvqdslVqtITxMa0LC5FVJJwx36CpszzsyS2q-oKlHeVvtOqom4Ul0YNShDBfN4pEO7lcaRMYU8arenmtm3DicXX7Mfp7ZUJj8iFWmKL5m2zGwZZcy6zC9eDU1EWA.MkKhkOEmaLF1RpzOKbitUJO_76rcSeJTyYGDlIl0GUE&dib_tag=se&keywords=NVIDIA+RTX+5090&qid=1756534255&sr=8-57,NVIDIA - GeForce RTX 5070 12GB GDDR7 Graphics Card - Graphite Grey,619,['* NVIDIA Blackwell Architecture * NVIDIA DLSS 4 * On-board memory * Game Ready and NVIDIA Studio Drivers * NVIDIA App * NVIDIA Studio * NVIDIA Broadcast * Memory Bandwidth * Interface Compatibility * Display Support'],https://m.media-amazon.com/images/I/71CXXxhCzdL._AC_SX679_.jpg,4.1
https://www.amazon.com/GIGABYTE-GV-N5090WF3OC-Architecture-Reinforced-Server-Grade/dp/B0F29XB3C8/ref=sr_1_58?dib=eyJ2IjoiMSJ9.5XzHLAjkfXSTc0tlFdefwB86rl_i9rL0wCdceHIH7XmJ5P-i22N31yluxfE-ifTW84Ky5hByGy0vXomgTNjwUZteaUVoVOnOr2RF4H-TNACqJcodvqdslVqtITxMa0LC5FVJJwx36CpszzsyS2q-oKlHeVvtOqom4Ul0YNShDBfN4pEO7lcaRMYU8arenmtm3DicXX7Mfp7ZUJj8iFWmKL5m2zGwZZcy6zC9eDU1EWA.MkKhkOEmaLF1RpzOKbitUJO_76rcSeJTyYGDlIl0GUE&dib_tag=se&keywords=NVIDIA+RTX+5090&qid=1756534255&sr=8-58,"GIGABYTE Windforce GeForce RTX 5090 OC 32GB GDDR7 Graphic Card GPU GV-N5090WF3OC (Blackwell Architecture and DLSS, 3 Fans, Reinforced Structure, Server-Grade Thermal Conductive Gel) with HDMI Cable.","2,959","['Powered by the NVIDIA Blackwell architecture and DLSS 4', 'Powered by GeForce RTX 5090', 'Integrated with 32GB GDDR7 512bit memory interface', 'WINDFORCE cooling system', 'Hawk fan', 'Server-grade Thermal conductive gel', 'Versatile VGA holder']",https://m.media-amazon.com/images/I/614JIgRjMxL._AC_SX679_.jpg,N/A
https://www.amazon.com/NVIDIA-GeForce-4080-GDDR6X-Graphics/dp/B0BMZ9TGH1/ref=sr_1_59?dib=eyJ2IjoiMSJ9.5XzHLAjkfXSTc0tlFdefwB86rl_i9rL0wCdceHIH7XmJ5P-i22N31yluxfE-ifTW84Ky5hByGy0vXomgTNjwUZteaUVoVOnOr2RF4H-TNACqJcodvqdslVqtITxMa0LC5FVJJwx36CpszzsyS2q-oKlHeVvtOqom4Ul0YNShDBfN4pEO7lcaRMYU8arenmtm3DicXX7Mfp7ZUJj8iFWmKL5m2zGwZZcy6zC9eDU1EWA.MkKhkOEmaLF1RpzOKbitUJO_76rcSeJTyYGDlIl0GUE&dib_tag=se&keywords=NVIDIA+RTX+5090&qid=1756534255&sr=8-59,NVIDIA - GeForce RTX 4080 16GB GDDR6X Graphics Card,"1,599","['Powered by the NVIDIA GeForce RTX 4080 (16GB) graphics processing unit (GPU) with a 2.51 GHz boost clock speed', 'PCI Express 4.0 and earlier PCI Express 3.0. Offers compatibility with a range of systems', '9,728 NVIDIA CUDA Cores, 2.51 GHz Boost Clock, Dedicated Ray Tracing Cores', 'Microsoft DirectX 12 Ultimate, Vulkan RT APIs']",https://m.media-amazon.com/images/I/71m9FJCubXL._AC_SX679_.jpg,4.5
https://www.amazon.com/Gigabyte-GeForce-5080-Gaming-Graphics/dp/B0DSQ1RCZV/ref=sr_1_60?dib=eyJ2IjoiMSJ9.5XzHLAjkfXSTc0tlFdefwB86rl_i9rL0wCdceHIH7XmJ5P-i22N31yluxfE-ifTW84Ky5hByGy0vXomgTNjwUZteaUVoVOnOr2RF4H-TNACqJcodvqdslVqtITxMa0LC5FVJJwx36CpszzsyS2q-oKlHeVvtOqom4Ul0YNShDBfN4pEO7lcaRMYU8arenmtm3DicXX7Mfp7ZUJj8iFWmKL5m2zGwZZcy6zC9eDU1EWA.MkKhkOEmaLF1RpzOKbitUJO_76rcSeJTyYGDlIl0GUE&dib_tag=se&keywords=NVIDIA+RTX+5090&qid=1756534255&sr=8-60,"Gigabyte GeForce RTX 5080 Gaming OC 16G Graphics Card - 16GB GDDR7, 256bit, PCI-E 5.0, 2730MHz Core Clock, 3 x DisplayPort, 1 x HDMI, GV-N5080GAMING OC-16GD","1,459","['Powered by GeForce RTX 5080', 'Integrated with 16GB GDDR7 256-bit memory interface', 'WINDFORCE cooling system', 'RGB Halo', 'Dual BIOS (Performance / Silent)', 'Reinforced structure and versatile VGA holder', '4 years warranty (Online registration required)']",https://m.media-amazon.com/images/I/81hMf6v5oSL._AC_SX679_.jpg,4.4
https://www.amazon.com/ASUS-DisplayPort-2-5-Slot-Axial-tech-Technology/dp/B0F7WB6LSH/ref=sr_1_61?dib=eyJ2IjoiMSJ9.5XzHLAjkfXSTc0tlFdefwB86rl_i9rL0wCdceHIH7XmJ5P-i22N31yluxfE-ifTW84Ky5hByGy0vXomgTNjwUZteaUVoVOnOr2RF4H-TNACqJcodvqdslVqtITxMa0LC5FVJJwx36CpszzsyS2q-oKlHeVvtOqom4Ul0YNShDBfN4pEO7lcaRMYU8arenmtm3DicXX7Mfp7ZUJj8iFWmKL5m2zGwZZcy6zC9eDU1EWA.MkKhkOEmaLF1RpzOKbitUJO_76rcSeJTyYGDlIl0GUE&dib_tag=se&keywords=NVIDIA+RTX+5090&qid=1756534255&sr=8-61,"ASUS Dual GeForce RTX™ 5060 Ti 16GB GDDR7 OC Edition (PCIe 5.0, 16GB GDDR7, DLSS 4, HDMI 2.1b, DisplayPort 2.1b, 2.5-Slot Design, Axial-tech Fan Design, 0dB Technology, and More)",479,"['AI Performance: 767 AI TOPS', 'OC mode: 2632 MHz (OC mode)/ 2602 MHz (Default mode)', 'Powered by the NVIDIA Blackwell architecture and DLSS 4', 'SFF-Ready Enthusiast GeForce Card', 'Axial-tech fan design features a smaller fan hub that facilitates longer blades and a barrier ring that increases downward air pressure']",https://m.media-amazon.com/images/I/81kYKB0Aj5L._AC_SX679_.jpg,4.6
https://www.amazon.com/Gigabyte-AORUS-GeForce-Stealth-Graphics/dp/B0FFMWXCQD/ref=sr_1_62?dib=eyJ2IjoiMSJ9.5XzHLAjkfXSTc0tlFdefwB86rl_i9rL0wCdceHIH7XmJ5P-i22N31yluxfE-ifTW84Ky5hByGy0vXomgTNjwUZteaUVoVOnOr2RF4H-TNACqJcodvqdslVqtITxMa0LC5FVJJwx36CpszzsyS2q-oKlHeVvtOqom4Ul0YNShDBfN4pEO7lcaRMYU8arenmtm3DicXX7Mfp7ZUJj8iFWmKL5m2zGwZZcy6zC9eDU1EWA.MkKhkOEmaLF1RpzOKbitUJO_76rcSeJTyYGDlIl0GUE&dib_tag=se&keywords=NVIDIA+RTX+5090&qid=1756534255&sr=8-62,"Gigabyte AORUS GeForce RTX 5090 Stealth ICE 32G Graphics Card - 32GB GDDR7, 512bit, PCI-E 5.0, 2655MHz Core Frequency, 3 x DP 2.1a, 1 x HDMI 2.1b, NVIDIA DLSS 4, GV-N5090AORUSST ICE-32GD","3,401.","['Powered by NVIDIA Blackwell architecture and DLSS 4', 'Powered by GeForce RTX 5090', 'Integrated with a 32GB 512bit GDDR7 memory interface', 'White look and compatible with the Stealth series', 'WINDFORCE Cooling System', 'LCD side view', 'RGB Halo']",https://m.media-amazon.com/images/I/71jr5uc2iqL._AC_SX679_.jpg,5.0
https://www.amazon.com/Ventus-FeForce-5090-Express-Extreme/dp/B0F3JW76Q6/ref=sr_1_63?dib=eyJ2IjoiMSJ9.5XzHLAjkfXSTc0tlFdefwB86rl_i9rL0wCdceHIH7XmJ5P-i22N31yluxfE-ifTW84Ky5hByGy0vXomgTNjwUZteaUVoVOnOr2RF4H-TNACqJcodvqdslVqtITxMa0LC5FVJJwx36CpszzsyS2q-oKlHeVvtOqom4Ul0YNShDBfN4pEO7lcaRMYU8arenmtm3DicXX7Mfp7ZUJj8iFWmKL5m2zGwZZcy6zC9eDU1EWA.MkKhkOEmaLF1RpzOKbitUJO_76rcSeJTyYGDlIl0GUE&dib_tag=se&keywords=NVIDIA+RTX+5090&qid=1756534255&sr=8-63,"MSI Ventus 3X FeForce RTX 5090 OC Edition 32 GB GDDR7, PCI Express Gen 5, Core Clocks Extreme: 2452 MHz, CUDA CORES 21760 Units, Memory Speed 28 Gbps, Bundle with Dockztorm Hub","3,247","['GeForce RTX 5090 32G VENTUS 3X OC', 'Graphics Processing Unit: NVIDIA GeForce RTX 5090', 'Interface: PCI Express Gen 5', 'Core Clocks: Extreme Performance: 2452 MHz (MSI Center). Boost: 2437 MHz', 'CUDA CORES: 21760 Units']",https://m.media-amazon.com/images/I/61QVqjzwUQL._AC_SX679_.jpg,N/A
