url,Product Name,Price,Description,Feature Image,Rating
https://www.amazon.com/PNY-Overclocked-Graphics-3-5-Slot-Epic-XTM/dp/B0DTJFSSZG/ref=sr_1_1?dib=eyJ2IjoiMSJ9.fvh4S5rKENwscVdC05tdNplympEte2vOQT9rX6FfcpgMpruZnv4RTkvRkJWX7d_sJ7VI3-mn9bOdbB9aXMKXvRvYGnRN7nG1FzfQu6V9joKEQ7fnRBxvrDt8Vg1bJ8JpjgulI6hJ2ovp5rLAt5HBGVnuX73p7q1OatLKspxsrhHnV989G84KjfiScoCIOvvJdjKB_vGAcWmKN5wD3EELNqSVhC0LqFoJ273SxTnisAg.ZcbbE6PlyAhkwZa17I-VI0FJ2mOTIa4bVTwDGB7cBNo&dib_tag=se&keywords=NVIDIA+RTX+5090&qid=1756534123&sr=8-1,"PNY NVIDIA GeForce RTX™ 5090 32GB ARGB Overclocked Triple Fan Graphics Card (DLSS 4, PCIe® 5.0, HDMI®/DP 2.1, 3.5-Slot, Epic-X™ RGB Lighting)","2,517","['NVIDIA DLSS 4 - Supreme Speed. Superior Visuals. Powered by AI. DLSS is a revolutionary suite of neural rendering technologies that uses AI to boost FPS, reduce latency, and improve image quality. \u200cThe latest breakthrough, DLSS 4, brings new Multi Frame Generation and enhanced Ray Reconstruction and Super Resolution, powered by GeForce RTX 50 Series GPUs and fifth-generation Tensor Cores. DLSS on GeForce RTX is the best way to play, backed by an NVIDIA AI supercomputer in the cloud constantly improving your PC’s gaming capabilities.', 'NVIDIA Reflex 2 - Compete at Warp Speed. Reflex technologies optimize the graphics pipeline for ultimate responsiveness, providing faster target acquisition, quicker reaction times, and improved aim precision in competitive games. Reflex 2 introduces Frame Warp (coming soon!), which further reduces latency based on the game’s latest mouse input.', 'RTX AI PCs - NVIDIA Powers the World’s AI. And Yours. Upgrade to advanced AI with NVIDIA GeForce RTX GPUs and accelerate your gaming, creating, productivity, and development. Thanks to built-in AI processors, you get world-leading AI technology powering your Windows PC.', 'Creators - Your Creative AI-dvantage. NVIDIA Studio is your creative advantage. GeForce RTX 50 Series GPUs unlock transformative performance in video editing, 3D rendering, and graphic design. Experience RTX accelerations in top creative apps, world-class NVIDIA Studio drivers engineered and continually updated to provide maximum stability, and a suite of exclusive tools that harness the power of RTX for AI-assisted creative workflows.']",https://m.media-amazon.com/images/I/61lmZjZXotL._AC_SX679_.jpg,4.2
https://www.amazon.com/ASUS-Military-Grade-Components-Protective-axial-tech/dp/B0DS2X13PH/ref=sr_1_2?dib=eyJ2IjoiMSJ9.fvh4S5rKENwscVdC05tdNplympEte2vOQT9rX6FfcpgMpruZnv4RTkvRkJWX7d_sJ7VI3-mn9bOdbB9aXMKXvRvYGnRN7nG1FzfQu6V9joKEQ7fnRBxvrDt8Vg1bJ8JpjgulI6hJ2ovp5rLAt5HBGVnuX73p7q1OatLKspxsrhHnV989G84KjfiScoCIOvvJdjKB_vGAcWmKN5wD3EELNqSVhC0LqFoJ273SxTnisAg.ZcbbE6PlyAhkwZa17I-VI0FJ2mOTIa4bVTwDGB7cBNo&dib_tag=se&keywords=NVIDIA+RTX+5090&qid=1756534123&sr=8-2,"ASUS TUF Gaming GeForce RTX ™ 5090 32GB GDDR7 OC Edition Gaming Graphics Card (PCIe® 5.0, HDMI®/DP 2.1, 3.6-Slot, Military-Grade Components, Protective PCB Coating, axial-tech Fans, Vapor Chamber)","2,700","['Powered by the NVIDIA Blackwell architecture and DLSS 4', 'Military-grade components deliver rock-solid power and longer lifespan for ultimate durability', 'Protective PCB coating helps protect against short circuits caused by moisture, dust, or debris', '3.6-slot design with massive fin array optimized for airflow from three Axial-tech fans', 'Phase-change GPU thermal pad helps ensure optimal thermal performance and longevity, outlasting traditional thermal paste for graphics cards under heavy loads']",https://m.media-amazon.com/images/I/71-gK950-SL._AC_SX679_.jpg,4.5
https://www.amazon.com/MSI-Graphics-512-bit-Extreme-Performance/dp/B0DT7L98J1/ref=sr_1_3?dib=eyJ2IjoiMSJ9.fvh4S5rKENwscVdC05tdNplympEte2vOQT9rX6FfcpgMpruZnv4RTkvRkJWX7d_sJ7VI3-mn9bOdbB9aXMKXvRvYGnRN7nG1FzfQu6V9joKEQ7fnRBxvrDt8Vg1bJ8JpjgulI6hJ2ovp5rLAt5HBGVnuX73p7q1OatLKspxsrhHnV989G84KjfiScoCIOvvJdjKB_vGAcWmKN5wD3EELNqSVhC0LqFoJ273SxTnisAg.ZcbbE6PlyAhkwZa17I-VI0FJ2mOTIa4bVTwDGB7cBNo&dib_tag=se&keywords=NVIDIA+RTX+5090&qid=1756534123&sr=8-3,"MSI Gaming RTX 5090 32G Gaming Trio OC Graphics Card (32GB GDDR7, 512-bit, Extreme Performance: 2497 MHz, DisplayPort x3 2.1a, HDMI 2.1b, NVIDIA Blackwell Architecture)","2,399","['Chipset: NVIDIA GeForce RTX 5090', 'Video Memory: 32 GB GDDR7', 'Memory Interface: 512-bit', 'Output: DisplayPort x 3 (v2.1a) / HDMI 2.1b x 1', 'Digital maximum resolution: 7680 x 4320']",https://m.media-amazon.com/images/I/71tV-csYdCL._AC_SX679_.jpg,4.5
https://www.amazon.com/GIGABYTE-Graphics-WINDFORCE-GV-N5090GAMING-OC-32GD/dp/B0DT7GBNWQ/ref=sr_1_4?dib=eyJ2IjoiMSJ9.fvh4S5rKENwscVdC05tdNplympEte2vOQT9rX6FfcpgMpruZnv4RTkvRkJWX7d_sJ7VI3-mn9bOdbB9aXMKXvRvYGnRN7nG1FzfQu6V9joKEQ7fnRBxvrDt8Vg1bJ8JpjgulI6hJ2ovp5rLAt5HBGVnuX73p7q1OatLKspxsrhHnV989G84KjfiScoCIOvvJdjKB_vGAcWmKN5wD3EELNqSVhC0LqFoJ273SxTnisAg.ZcbbE6PlyAhkwZa17I-VI0FJ2mOTIa4bVTwDGB7cBNo&dib_tag=se&keywords=NVIDIA+RTX+5090&qid=1756534123&sr=8-4,"GIGABYTE GeForce RTX 5090 Gaming OC 32G Graphics Card, WINDFORCE Cooling System, 32GB 512-bit GDDR7, GV-N5090GAMING OC-32GD Video Card","2,599","['Powered by the NVIDIA Blackwell architecture and DLSS 4', 'Powered by GeForce RTX 5090', 'Integrated with 32GB GDDR7 512bit memory interface', 'PCIe 5.0', 'WINDFORCE cooling system']",https://m.media-amazon.com/images/I/71TZmq7RYtL._AC_SX679_.jpg,3.9
https://www.amazon.com/ZOTAC-Graphics-IceStorm-Advanced-ZT-B50900J-10P/dp/B0DV6MK91R/ref=sr_1_5?dib=eyJ2IjoiMSJ9.fvh4S5rKENwscVdC05tdNplympEte2vOQT9rX6FfcpgMpruZnv4RTkvRkJWX7d_sJ7VI3-mn9bOdbB9aXMKXvRvYGnRN7nG1FzfQu6V9joKEQ7fnRBxvrDt8Vg1bJ8JpjgulI6hJ2ovp5rLAt5HBGVnuX73p7q1OatLKspxsrhHnV989G84KjfiScoCIOvvJdjKB_vGAcWmKN5wD3EELNqSVhC0LqFoJ273SxTnisAg.ZcbbE6PlyAhkwZa17I-VI0FJ2mOTIa4bVTwDGB7cBNo&dib_tag=se&keywords=NVIDIA+RTX+5090&qid=1756534123&sr=8-5,"ZOTAC Gaming GeForce RTX 5090 Solid OC DLSS 4 32GB GDDR7 512-bit 28 Gbps PCIE 5.0 Gaming Graphics Card, IceStorm 3.0 Advanced Cooling, Spectra 2.0 ARGB Lighting, ZT-B50900J-10P","2,227","['Powered by the NVIDIA Blackwell architecture and DLSS 4', '32GB GDDR7, 512-bit, 28 Gbps, PCIE 5.0, Boost Clock 2422 MHz', 'IceStorm 3.0 Advanced Cooling, 3x 100mm BladeLink fans, Vapor Chamber, Composite Heatpipes, Pass-thru Airflow Design, FREEZE Fan Stop, Active Fan Control 2.0', 'Metal Backplate, Reinforced Frame Structure, Dual BIOS, SPECTRA 2.0 ARGB Lighting, SPECTRA Link, Bundled GPU Support Stand', '3 x DisplayPort 2.1b, 1 x HDMI 2.1b, 8K Ready, 4 Display Ready, HDCP 2.3, VR Ready']",https://m.media-amazon.com/images/I/71c7k-TNofL._AC_SX679_.jpg,4.2
https://www.amazon.com/MSI-RTX-5090-32G-SOC/dp/B0DT7KGND2/ref=sr_1_6?dib=eyJ2IjoiMSJ9.fvh4S5rKENwscVdC05tdNplympEte2vOQT9rX6FfcpgMpruZnv4RTkvRkJWX7d_sJ7VI3-mn9bOdbB9aXMKXvRvYGnRN7nG1FzfQu6V9joKEQ7fnRBxvrDt8Vg1bJ8JpjgulI6hJ2ovp5rLAt5HBGVnuX73p7q1OatLKspxsrhHnV989G84KjfiScoCIOvvJdjKB_vGAcWmKN5wD3EELNqSVhC0LqFoJ273SxTnisAg.ZcbbE6PlyAhkwZa17I-VI0FJ2mOTIa4bVTwDGB7cBNo&dib_tag=se&keywords=NVIDIA+RTX+5090&qid=1756534123&sr=8-6,"MSI Gaming RTX 5090 32G Vanguard SOC Graphics Card (32GB GDDR7, 512-bit, Extreme Performance: 2527 MHz, DisplayPort x3 2.1a, HDMI 2.1b, NVIDIA Blackwell Architecture)","2,474","['Chipset: NVIDIA GeForce RTX 5090', 'Video Memory: 32 GB GDDR7', 'Memory Interface: 512-bit', 'Output: DisplayPort x 3 (v2.1a) / HDMI 2.1b x 1', 'Digital maximum resolution: 7680 x 4320']",https://m.media-amazon.com/images/I/715PJSwhFBL._AC_SX679_.jpg,4.3
https://www.amazon.com/Empowered-PC-9001G1442530000-Blackwell-Graphics/dp/B0FFPJ7THP/ref=sr_1_7?dib=eyJ2IjoiMSJ9.fvh4S5rKENwscVdC05tdNplympEte2vOQT9rX6FfcpgMpruZnv4RTkvRkJWX7d_sJ7VI3-mn9bOdbB9aXMKXvRvYGnRN7nG1FzfQu6V9joKEQ7fnRBxvrDt8Vg1bJ8JpjgulI6hJ2ovp5rLAt5HBGVnuX73p7q1OatLKspxsrhHnV989G84KjfiScoCIOvvJdjKB_vGAcWmKN5wD3EELNqSVhC0LqFoJ273SxTnisAg.ZcbbE6PlyAhkwZa17I-VI0FJ2mOTIa4bVTwDGB7cBNo&dib_tag=se&keywords=NVIDIA+RTX+5090&qid=1756534123&sr=8-7,Blackwell Graphics Card,"2,638",['N/A'],https://m.media-amazon.com/images/I/51zFYVroW8L._AC_SX679_.jpg,3.9
https://www.amazon.com/MSI-Graphics-512-bit-Extreme-Performance/dp/B0DT7JS6BG/ref=sr_1_8?dib=eyJ2IjoiMSJ9.fvh4S5rKENwscVdC05tdNplympEte2vOQT9rX6FfcpgMpruZnv4RTkvRkJWX7d_sJ7VI3-mn9bOdbB9aXMKXvRvYGnRN7nG1FzfQu6V9joKEQ7fnRBxvrDt8Vg1bJ8JpjgulI6hJ2ovp5rLAt5HBGVnuX73p7q1OatLKspxsrhHnV989G84KjfiScoCIOvvJdjKB_vGAcWmKN5wD3EELNqSVhC0LqFoJ273SxTnisAg.ZcbbE6PlyAhkwZa17I-VI0FJ2mOTIa4bVTwDGB7cBNo&dib_tag=se&keywords=NVIDIA+RTX+5090&qid=1756534123&sr=8-8,"MSI Gaming RTX 5090 32G Ventus 3X OC Graphics Card (32GB GDDR7, 512-bit, Extreme Performance: 2452 MHz, DisplayPort x3 2.1a, HDMI 2.1b, NVIDIA Blackwell Architecture)","2,276","['Chipset: NVIDIA GeForce RTX 5090', 'Video Memory: 32 GB GDDR7', 'Memory Interface: 512-bit', 'Output: DisplayPort x 3 (v2.1a) / HDMI 2.1b x 1', 'Digital maximum resolution: 7680 x 4320']",https://m.media-amazon.com/images/I/71key2VASKL._AC_SX679_.jpg,4.0
https://www.amazon.com/GIGABYTE-Graphics-WINDFORCE-GV-N5090AORUSM-ICE-32GD/dp/B0DVCH9WJH/ref=sr_1_9?dib=eyJ2IjoiMSJ9.fvh4S5rKENwscVdC05tdNplympEte2vOQT9rX6FfcpgMpruZnv4RTkvRkJWX7d_sJ7VI3-mn9bOdbB9aXMKXvRvYGnRN7nG1FzfQu6V9joKEQ7fnRBxvrDt8Vg1bJ8JpjgulI6hJ2ovp5rLAt5HBGVnuX73p7q1OatLKspxsrhHnV989G84KjfiScoCIOvvJdjKB_vGAcWmKN5wD3EELNqSVhC0LqFoJ273SxTnisAg.ZcbbE6PlyAhkwZa17I-VI0FJ2mOTIa4bVTwDGB7cBNo&dib_tag=se&keywords=NVIDIA+RTX+5090&qid=1756534123&sr=8-9,"GIGABYTE AORUS GeForce RTX 5090 Master ICE 32G Graphics Card, WINDFORCE Cooling System, 32GB 512-bit GDDR7, GV-N5090AORUSM ICE-32GD Video Card","2,824","['NVIDIA Blackwell architecture and DLSS 4', 'Powered by GeForce RTX 5090', 'Integrated with 32GB GDDR7 512bit memory interface', 'PCIe 5.0', 'WINDFORCE cooling system with Hawk Fan']",https://m.media-amazon.com/images/I/71m0Z3xgGVL._AC_SX679_.jpg,4.4
https://www.amazon.com/ASUS-NVIDIA-GeForce-Express-TUF-RTX5090-32G-GAMING/dp/B0DZFYPWDG/ref=sr_1_10?dib=eyJ2IjoiMSJ9.fvh4S5rKENwscVdC05tdNplympEte2vOQT9rX6FfcpgMpruZnv4RTkvRkJWX7d_sJ7VI3-mn9bOdbB9aXMKXvRvYGnRN7nG1FzfQu6V9joKEQ7fnRBxvrDt8Vg1bJ8JpjgulI6hJ2ovp5rLAt5HBGVnuX73p7q1OatLKspxsrhHnV989G84KjfiScoCIOvvJdjKB_vGAcWmKN5wD3EELNqSVhC0LqFoJ273SxTnisAg.ZcbbE6PlyAhkwZa17I-VI0FJ2mOTIa4bVTwDGB7cBNo&dib_tag=se&keywords=NVIDIA+RTX+5090&qid=1756534123&sr=8-10,ASUS NVIDIA GeForce RTX 5090 Video Card 32GB GDDR7 PCI Express 5.0 / TUF-RTX5090-32G-GAMING,"2,539","[""MaxContact Design: ASUS's proprietary manufacturing process increases the surface area of the GPU heat spreader by 5%. Combined with a powerful heat sink and Axial-tech fan for temperature improvement up to 2°C"", '12 HEAT PIPES & VAPER CHAMPS: Large heat sink with vapor chamber and 12 heat pipes efficiently absorb heat from GeForce RTX 5090 GPU for superior performance', 'Phase Change GPU Thermal Pad: Melts and fills the gap between the GPU and thermal module for superior heat conductivity and heat dissipation, ensuring optimal performance and longevity of graphics cards even under heavy loads', 'Large Vapor Chamber: Absorbs heat from GPU efficiently for superior performance', 'NEW FAN ROTATION SYSTEM: The two outer fans rotate counterclockwise to reduce turbulence The GPU temperature stops at less than 50°C, and restarts at above 55°C, providing both performance and silence']",https://m.media-amazon.com/images/I/81BE1H1w23L.__AC_SX300_SY300_QL70_FMwebp_.jpg,4.6
https://www.amazon.com/GeForce-Graphics-3-8-Slot-Detachable-Withstand/dp/B0FJVQYGQW/ref=sr_1_11?dib=eyJ2IjoiMSJ9.fvh4S5rKENwscVdC05tdNplympEte2vOQT9rX6FfcpgMpruZnv4RTkvRkJWX7d_sJ7VI3-mn9bOdbB9aXMKXvRvYGnRN7nG1FzfQu6V9joKEQ7fnRBxvrDt8Vg1bJ8JpjgulI6hJ2ovp5rLAt5HBGVnuX73p7q1OatLKspxsrhHnV989G84KjfiScoCIOvvJdjKB_vGAcWmKN5wD3EELNqSVhC0LqFoJ273SxTnisAg.ZcbbE6PlyAhkwZa17I-VI0FJ2mOTIa4bVTwDGB7cBNo&dib_tag=se&keywords=NVIDIA+RTX+5090&qid=1756534123&sr=8-11,"ROG Astral GeForce RTX™ 5090 BTF OC Edition Gaming Graphics Card (PCIe® 5.0, 32GB GDDR7, HDMI®/DP 2.1, 3.8-Slot, Detachable Graphics Card high Power (GC-HPWR) Adapter Withstand up to 1000W, 4 Fans)","3,499","['AI Performance: 3593 AI TOPS', 'Powered by the NVIDIA Blackwell architecture and DLSS 4.', 'OC mode: 2610 MHz (OC mode)/ 2580 MHz (Default mode)', 'Featuring an innovative detachable graphics card high-power (GC-HPWR) adapter for compatibility with standard and BTF motherboards', 'The GC-HPWR adapter can withstand up to 1000 watts. Powerful 80-amp MOSFETs help ensure enhanced performance, stability, and higher overclocking potential', 'Quad-fan design boosts air flow and pressure by up to 20%', 'Patented vapor chamber with milled heatspreader for lower GPU temperatures. Full metal diecast shroud, frame backplate, and rear I/O bracket brace the PCB for rigidity']",https://m.media-amazon.com/images/I/81I4gjI-KOL._AC_SX679_.jpg,N/A
https://www.amazon.com/ASUS-Graphics-3-8-Slot-Axial-tech-Phase-Change/dp/B0DS2X3T6P/ref=sr_1_12?dib=eyJ2IjoiMSJ9.fvh4S5rKENwscVdC05tdNplympEte2vOQT9rX6FfcpgMpruZnv4RTkvRkJWX7d_sJ7VI3-mn9bOdbB9aXMKXvRvYGnRN7nG1FzfQu6V9joKEQ7fnRBxvrDt8Vg1bJ8JpjgulI6hJ2ovp5rLAt5HBGVnuX73p7q1OatLKspxsrhHnV989G84KjfiScoCIOvvJdjKB_vGAcWmKN5wD3EELNqSVhC0LqFoJ273SxTnisAg.ZcbbE6PlyAhkwZa17I-VI0FJ2mOTIa4bVTwDGB7cBNo&dib_tag=se&keywords=NVIDIA+RTX+5090&qid=1756534123&sr=8-12,"ASUS ROG Astral GeForce RTX™ 5090 Gaming Graphics Card (PCIe® 5.0, 32GB GDDR7, HDMI®/DP 2.1, 3.8-Slot, 4-Fan Design, Axial-tech Fans, Patented Vapor Chamber, Phase-Change GPU Thermal pad)","3,299","['Powered by the NVIDIA Blackwell architecture and DLSS 4. GPU Tweak III software provides intuitive performance tweaking, advanced thermal controls, and system monitoring', 'OC Mode: 2467 MHz/Default mode 2437 MHz (Boost Clock). Quad-fan design boosts air flow and pressure by up to 20%.', 'Patented vapor chamber with milled heatspreader for lower GPU temperatures', 'Phase-change GPU thermal pad ensures optimal heat transfer, lowering GPU temperatures for enhanced performance and reliability', '3.8-slot design: massive heatsink and fin array optimized for airflow from the four Axial-tech fans', 'Secure GPU protection with GPU Guard technology securing four corners of the GPU and GPU bracket ensures stable mounting', 'Full metal diecast shroud, frame backplate, and rear I/O bracket brace the PCB for rigidity']",https://m.media-amazon.com/images/I/81tE8puC+1L._AC_SX679_.jpg,N/A
https://www.amazon.com/MSI-Graphics-512-bit-Extreme-Performance/dp/B0DT7K9VV3/ref=sr_1_13?dib=eyJ2IjoiMSJ9.fvh4S5rKENwscVdC05tdNplympEte2vOQT9rX6FfcpgMpruZnv4RTkvRkJWX7d_sJ7VI3-mn9bOdbB9aXMKXvRvYGnRN7nG1FzfQu6V9joKEQ7fnRBxvrDt8Vg1bJ8JpjgulI6hJ2ovp5rLAt5HBGVnuX73p7q1OatLKspxsrhHnV989G84KjfiScoCIOvvJdjKB_vGAcWmKN5wD3EELNqSVhC0LqFoJ273SxTnisAg.ZcbbE6PlyAhkwZa17I-VI0FJ2mOTIa4bVTwDGB7cBNo&dib_tag=se&keywords=NVIDIA+RTX+5090&qid=1756534123&sr=8-13,"MSI Gaming RTX 5090 32G SUPRIM Liquid SOC Graphics Card (32GB GDDR7, 512-bit, Extreme Performance: 2580 MHz, DisplayPort x3 2.1a, HDMI 2.1b, NVIDIA Blackwell Architecture)","2,999","['Chipset: NVIDIA GeForce RTX 5090', 'Video Memory: 32 GB GDDR7', 'Memory Interface: 512-bit', 'Output: DisplayPort x 3 (v2.1a) / HDMI 2.1b x 1', 'Digital maximum resolution: 7680 x 4320']",https://m.media-amazon.com/images/I/71Lziw+PHhL._AC_SX679_.jpg,4.6
https://www.amazon.com/GIGABYTE-GeForce-WINDFORCE-Graphics-GV-N5090WF3OC-32GD/dp/B0DVCBDJBJ/ref=sr_1_14?dib=eyJ2IjoiMSJ9.fvh4S5rKENwscVdC05tdNplympEte2vOQT9rX6FfcpgMpruZnv4RTkvRkJWX7d_sJ7VI3-mn9bOdbB9aXMKXvRvYGnRN7nG1FzfQu6V9joKEQ7fnRBxvrDt8Vg1bJ8JpjgulI6hJ2ovp5rLAt5HBGVnuX73p7q1OatLKspxsrhHnV989G84KjfiScoCIOvvJdjKB_vGAcWmKN5wD3EELNqSVhC0LqFoJ273SxTnisAg.ZcbbE6PlyAhkwZa17I-VI0FJ2mOTIa4bVTwDGB7cBNo&dib_tag=se&keywords=NVIDIA+RTX+5090&qid=1756534123&sr=8-14,"GIGABYTE GeForce RTX 5090 WINDFORCE OC 32G Graphics Card - 32GB GDDR7, 512 Bits, PCI-E 5.0, 2467MHz Core Frequency, 3 x DP 2.1a, 1x HDMI 2.1b, NVIDIA DLSS 4, GV-N5090WF3OC-32GD","2,639","['Equipped with GeForce RTX 5090 chipset', 'Integrated with 32GB 512-bit GDDR7 memory interface', 'WINDFORCE Cooling System', 'Dual BIOS (Performance / Quiet)', 'Reinforced structure', 'Versatile VGA Stand']",https://m.media-amazon.com/images/I/71sQV0K2IjL._AC_SX679_.jpg,4.8
https://www.amazon.com/ASUS-3-125-slot-Military-Grade-Components-Protective/dp/B0DS6S98ZF/ref=sr_1_15?dib=eyJ2IjoiMSJ9.fvh4S5rKENwscVdC05tdNplympEte2vOQT9rX6FfcpgMpruZnv4RTkvRkJWX7d_sJ7VI3-mn9bOdbB9aXMKXvRvYGnRN7nG1FzfQu6V9joKEQ7fnRBxvrDt8Vg1bJ8JpjgulI6hJ2ovp5rLAt5HBGVnuX73p7q1OatLKspxsrhHnV989G84KjfiScoCIOvvJdjKB_vGAcWmKN5wD3EELNqSVhC0LqFoJ273SxTnisAg.ZcbbE6PlyAhkwZa17I-VI0FJ2mOTIa4bVTwDGB7cBNo&dib_tag=se&keywords=NVIDIA+RTX+5090&qid=1756534123&sr=8-15,"ASUS TUF Gaming GeForce RTX ™ 5070 12GB GDDR7 OC Edition Gaming Graphics Card (PCIe® 5.0, HDMI®/DP 2.1, 3.125-slot, Military-Grade Components, Protective PCB Coating, axial-tech Fans)",619,"['Powered by the NVIDIA Blackwell architecture and DLSS 4', 'Military-grade components deliver rock-solid power and longer lifespan for ultimate durability', 'Protective PCB coating helps protect against short circuits caused by moisture, dust, or debris', '3.125-slot design with massive fin array optimized for airflow from three Axial-tech fans', 'Phase-change GPU thermal pad helps ensure optimal thermal performance and longevity, outlasting traditional thermal paste for graphics cards under heavy loads', 'ASUS GPU Guard and bracket secure the GPU, reducing the risk of cracks and ensuring stable mounting', 'Auto-Extreme precision automated manufacturing helps ensure higher reliability', 'GPU Tweak III software provides intuitive performance tweaking, advanced thermal controls, and system monitoring']",https://m.media-amazon.com/images/I/815-M4vy8JL._AC_SX679_.jpg,4.6
https://www.amazon.com/ZOTAC-Graphics-IceStorm-Advanced-ZT-B50900Q-10P/dp/B0F85ZQ72C/ref=sr_1_16?dib=eyJ2IjoiMSJ9.fvh4S5rKENwscVdC05tdNplympEte2vOQT9rX6FfcpgMpruZnv4RTkvRkJWX7d_sJ7VI3-mn9bOdbB9aXMKXvRvYGnRN7nG1FzfQu6V9joKEQ7fnRBxvrDt8Vg1bJ8JpjgulI6hJ2ovp5rLAt5HBGVnuX73p7q1OatLKspxsrhHnV989G84KjfiScoCIOvvJdjKB_vGAcWmKN5wD3EELNqSVhC0LqFoJ273SxTnisAg.ZcbbE6PlyAhkwZa17I-VI0FJ2mOTIa4bVTwDGB7cBNo&dib_tag=se&keywords=NVIDIA+RTX+5090&qid=1756534123&sr=8-16,"ZOTAC Gaming GeForce RTX 5090 Solid OC White Edition DLSS 4 32GB GDDR7 512-bit 28 Gbps PCIE 5.0 Gaming Graphics Card, IceStorm 3.0 Advanced Cooling, Spectra 2.0 ARGB Lighting, ZT-B50900Q-10P","2,399","['Powered by the NVIDIA Blackwell architecture and DLSS 4', '32GB GDDR7, 512-bit, 28 Gbps, PCIE 5.0, Boost Clock 2422 MHz', 'IceStorm 3.0 Advanced Cooling, 3x 100mm BladeLink fans, Vapor Chamber, Composite Heatpipes, Pass-thru Airflow Design, FREEZE Fan Stop, Active Fan Control 2.0', 'Metal Backplate, Reinforced Frame Structure, Dual BIOS, SPECTRA 2.0 ARGB Lighting, SPECTRA Link, Bundled GPU Support Stand', '3 x DisplayPort 2.1b, 1 x HDMI 2.1b, 8K Ready, 4 Display Ready, HDCP 2.3, VR Ready']",https://m.media-amazon.com/images/I/81ubl5FITQL._AC_SX679_.jpg,4.3
https://www.amazon.com/sspa/click?ie=UTF8&spc=MToyODM4OTY4NjEyNjI3MTQ4OjE3NTY1MzQxNjY6c3BfYXRmX25leHQ6MzAwODM0Mjc2MTgxNTAyOjowOjo&url=%2FPNY-Overclocked-Graphics-3-5-Slot-Epic-XTM%2Fdp%2FB0DTJFSSZG%2Fref%3Dsr_1_17_sspa%3Fdib%3DeyJ2IjoiMSJ9.LM9usqooaecXC07F-ojCER48h3y5BX5hV-lG_qhPaF9mXMscv7Ar4H8Iv1_yLDFXbe1b_9fVlQN_H-sznakcGCxVG5d46hqzE04wo2Bkabng--Q9L9y-SvW5aZLY-cygYfYYQeFGRMPoBmDPKXz7aZvA1ElKUWYMYNkvDSfc27bMardjh9X0VsbP95rW1BfxLZHGNaEraL2f_onIVQsZ84DPKAX9ZxRJh1Hk8MV5XXs.tlEISSWMNe8RgfVIi-8WkUATloHiPf463MyvHlA7Cws%26dib_tag%3Dse%26keywords%3DNVIDIA%2BRTX%2B5090%26qid%3D1756534166%26sr%3D8-17-spons%26sp_csd%3Dd2lkZ2V0TmFtZT1zcF9hdGZfbmV4dA%26psc%3D1,"PNY NVIDIA GeForce RTX™ 5090 32GB ARGB Overclocked Triple Fan Graphics Card (DLSS 4, PCIe® 5.0, HDMI®/DP 2.1, 3.5-Slot, Epic-X™ RGB Lighting)","2,517","['NVIDIA DLSS 4 - Supreme Speed. Superior Visuals. Powered by AI. DLSS is a revolutionary suite of neural rendering technologies that uses AI to boost FPS, reduce latency, and improve image quality. \u200cThe latest breakthrough, DLSS 4, brings new Multi Frame Generation and enhanced Ray Reconstruction and Super Resolution, powered by GeForce RTX 50 Series GPUs and fifth-generation Tensor Cores. DLSS on GeForce RTX is the best way to play, backed by an NVIDIA AI supercomputer in the cloud constantly improving your PC’s gaming capabilities.', 'NVIDIA Reflex 2 - Compete at Warp Speed. Reflex technologies optimize the graphics pipeline for ultimate responsiveness, providing faster target acquisition, quicker reaction times, and improved aim precision in competitive games. Reflex 2 introduces Frame Warp (coming soon!), which further reduces latency based on the game’s latest mouse input.', 'RTX AI PCs - NVIDIA Powers the World’s AI. And Yours. Upgrade to advanced AI with NVIDIA GeForce RTX GPUs and accelerate your gaming, creating, productivity, and development. Thanks to built-in AI processors, you get world-leading AI technology powering your Windows PC.', 'Creators - Your Creative AI-dvantage. NVIDIA Studio is your creative advantage. GeForce RTX 50 Series GPUs unlock transformative performance in video editing, 3D rendering, and graphic design. Experience RTX accelerations in top creative apps, world-class NVIDIA Studio drivers engineered and continually updated to provide maximum stability, and a suite of exclusive tools that harness the power of RTX for AI-assisted creative workflows.']",https://m.media-amazon.com/images/I/61lmZjZXotL._AC_SX679_.jpg,4.2
https://www.amazon.com/NVIDIA-GeForce-RTX-5080-Founders/dp/B0DYVCGVK4/ref=sr_1_18?dib=eyJ2IjoiMSJ9.LM9usqooaecXC07F-ojCER48h3y5BX5hV-lG_qhPaF9mXMscv7Ar4H8Iv1_yLDFXbe1b_9fVlQN_H-sznakcGCxVG5d46hqzE04wo2Bkabng--Q9L9y-SvW5aZLY-cygYfYYQeFGRMPoBmDPKXz7aZvA1ElKUWYMYNkvDSfc27bMardjh9X0VsbP95rW1BfxLZHGNaEraL2f_onIVQsZ84DPKAX9ZxRJh1Hk8MV5XXs.tlEISSWMNe8RgfVIi-8WkUATloHiPf463MyvHlA7Cws&dib_tag=se&keywords=NVIDIA+RTX+5090&qid=1756534166&sr=8-18,NVIDIA GeForce RTX 5080 Founders Edition,"1,293","['NVIDIA Blackwell Architecture, the ultimate platform for gamers and creators Tensor Cores maximum AI performance with FP4 and DLSS 4 NVIDIA Reflex 2 with frame-warping full-ray tracing with neural rendering', 'Video Card', 'NVIDIA']",https://m.media-amazon.com/images/I/31DskP4o6yL._AC_.jpg,4.1
https://www.amazon.com/MSI-Graphics-512-bit-Extreme-Performance/dp/B0DT7JYTXQ/ref=sr_1_19?dib=eyJ2IjoiMSJ9.LM9usqooaecXC07F-ojCER48h3y5BX5hV-lG_qhPaF9mXMscv7Ar4H8Iv1_yLDFXbe1b_9fVlQN_H-sznakcGCxVG5d46hqzE04wo2Bkabng--Q9L9y-SvW5aZLY-cygYfYYQeFGRMPoBmDPKXz7aZvA1ElKUWYMYNkvDSfc27bMardjh9X0VsbP95rW1BfxLZHGNaEraL2f_onIVQsZ84DPKAX9ZxRJh1Hk8MV5XXs.tlEISSWMNe8RgfVIi-8WkUATloHiPf463MyvHlA7Cws&dib_tag=se&keywords=NVIDIA+RTX+5090&qid=1756534166&sr=8-19,"MSI Gaming RTX 5090 32G SUPRIM SOC Graphics Card (32GB GDDR7, 512-bit, Extreme Performance: 2580 MHz, DisplayPort x3 2.1a, HDMI 2.1b, NVIDIA Blackwell Architecture)","2,699","['Chipset: NVIDIA GeForce RTX 5090', 'Video Memory: 32 GB GDDR7', 'Memory Interface: 512-bit', 'Output: DisplayPort x 3 (v2.1a) / HDMI 2.1b x 1', 'Digital maximum resolution: 7680 x 4320']",https://m.media-amazon.com/images/I/71TmAlxOmJL._AC_SX679_.jpg,5.0
https://www.amazon.com/MSI-GeForce-Gaming-28Gbps-512-bit/dp/B0DT6Q3BXM/ref=sr_1_20?dib=eyJ2IjoiMSJ9.LM9usqooaecXC07F-ojCER48h3y5BX5hV-lG_qhPaF9mXMscv7Ar4H8Iv1_yLDFXbe1b_9fVlQN_H-sznakcGCxVG5d46hqzE04wo2Bkabng--Q9L9y-SvW5aZLY-cygYfYYQeFGRMPoBmDPKXz7aZvA1ElKUWYMYNkvDSfc27bMardjh9X0VsbP95rW1BfxLZHGNaEraL2f_onIVQsZ84DPKAX9ZxRJh1Hk8MV5XXs.tlEISSWMNe8RgfVIi-8WkUATloHiPf463MyvHlA7Cws&dib_tag=se&keywords=NVIDIA+RTX+5090&qid=1756534166&sr=8-20,"MSI GeForce RTX 5090 32G Gaming Trio OC 32GB GDDR7 (28Gbps/512-bit), PCIe 5, Boost: 2482MHz, HDMI 2.1b, DisplayPort 2.1b","3,179",['W129123897'],https://m.media-amazon.com/images/I/71tV-csYdCL._AC_SX679_.jpg,4.0
https://www.amazon.com/PNY-GeForce-RTX-5090-Triple/dp/B0F2PV42RL/ref=sr_1_21?dib=eyJ2IjoiMSJ9.LM9usqooaecXC07F-ojCER48h3y5BX5hV-lG_qhPaF9mXMscv7Ar4H8Iv1_yLDFXbe1b_9fVlQN_H-sznakcGCxVG5d46hqzE04wo2Bkabng--Q9L9y-SvW5aZLY-cygYfYYQeFGRMPoBmDPKXz7aZvA1ElKUWYMYNkvDSfc27bMardjh9X0VsbP95rW1BfxLZHGNaEraL2f_onIVQsZ84DPKAX9ZxRJh1Hk8MV5XXs.tlEISSWMNe8RgfVIi-8WkUATloHiPf463MyvHlA7Cws&dib_tag=se&keywords=NVIDIA+RTX+5090&qid=1756534166&sr=8-21,PNY GeForce RTX 5090 Triple Fan GPU,"2,499","['NVIDIA Blackwell Architecture 32GB GDDR7 Memory 3x Display Port 1x HDMI 21,760 CUDA Cores 575 W Thermal Design Power']",https://m.media-amazon.com/images/I/51nKnvTR5TL._AC_SX679_.jpg,3.7
https://www.amazon.com/MSI-GeForce-5090-SUPRIM-Liquid/dp/B0BSN426TP/ref=sr_1_22?dib=eyJ2IjoiMSJ9.LM9usqooaecXC07F-ojCER48h3y5BX5hV-lG_qhPaF9mXMscv7Ar4H8Iv1_yLDFXbe1b_9fVlQN_H-sznakcGCxVG5d46hqzE04wo2Bkabng--Q9L9y-SvW5aZLY-cygYfYYQeFGRMPoBmDPKXz7aZvA1ElKUWYMYNkvDSfc27bMardjh9X0VsbP95rW1BfxLZHGNaEraL2f_onIVQsZ84DPKAX9ZxRJh1Hk8MV5XXs.tlEISSWMNe8RgfVIi-8WkUATloHiPf463MyvHlA7Cws&dib_tag=se&keywords=NVIDIA+RTX+5090&qid=1756534166&sr=8-22,"MSI GeForce RTX 5090 32G SUPRIM Liquid SOC — 32GB GDDR7 (28Gbps/512-bit), PCIe 5, Boost: 2565MHz, Water Cooling, HDMI 2.1b, DisplayPort 2.1b","3,739","['NVIDIA Blackwell Architecture - NVIDIA Blackwell architecture delivers the groundbreaking realism of complete ray tracing.', 'DLSS 4 - DLSS is a revolutionary collection of neural rendering technologies that uses AI to increase FPS, reduce latency and improve image quality.', 'GDDR7 - GDDR7 is the next generation of graphics memory that delivers faster speeds and improved energy efficiency.', 'SUPRIM Series - With the MSI SUPRIM graphics card, you get first-class performance that combines high-quality design and materials with advanced water cooling.', 'A power supply with min. 1000 W and the latest drivers.']",https://m.media-amazon.com/images/I/61W07KSaKYL._AC_SX679_.jpg,4.6
