url,Product Name,Price,Description,Feature Image,Rating
https://www.amazon.com/sspa/click?ie=UTF8&spc=MTo0MzU5NDE2NTEzOTE2MTI5OjE3NTY1MzQzNDE6c3BfYXRmX25leHQ6MzAwODM0Mjc2MTgxNTAyOjowOjo&url=%2FPNY-Overclocked-Graphics-3-5-Slot-Epic-XTM%2Fdp%2FB0DTJFSSZG%2Fref%3Dsr_1_81_sspa%3Fdib%3DeyJ2IjoiMSJ9.DzoufdesyCmZjDVd9SKcvLZ1s52x8YvSGa_Zc7amGGNOECFTLefWZbZ_tF2qRlE4k0r80XLeyR06lJdvbY1BkFgiwAEC9xIUiCQPFeI-KeRsF6tOl9yexHkOkDbaF9i47BhPAxeQOErDdDgUASLsa8obowtX1Ps8TLrsu95XO3czLWTPPvcxZUk9YKzVBwzW9_GtFSlvYAB-9acYOF3KUoCUklFjNvgT4FevoNYZ-2E.vS_0fmnCV0aJi5KDYjb5u4DhYq8HUhDaGiwOJEbELSQ%26dib_tag%3Dse%26keywords%3DNVIDIA%2BRTX%2B5090%26qid%3D1756534341%26sr%3D8-81-spons%26sp_csd%3Dd2lkZ2V0TmFtZT1zcF9hdGZfbmV4dA%26psc%3D1,"PNY NVIDIA GeForce RTX™ 5090 32GB ARGB Overclocked Triple Fan Graphics Card (DLSS 4, PCIe® 5.0, HDMI®/DP 2.1, 3.5-Slot, Epic-X™ RGB Lighting)","2,517","['NVIDIA DLSS 4 - Supreme Speed. Superior Visuals. Powered by AI. DLSS is a revolutionary suite of neural rendering technologies that uses AI to boost FPS, reduce latency, and improve image quality. \u200cThe latest breakthrough, DLSS 4, brings new Multi Frame Generation and enhanced Ray Reconstruction and Super Resolution, powered by GeForce RTX 50 Series GPUs and fifth-generation Tensor Cores. DLSS on GeForce RTX is the best way to play, backed by an NVIDIA AI supercomputer in the cloud constantly improving your PC’s gaming capabilities.', 'NVIDIA Reflex 2 - Compete at Warp Speed. Reflex technologies optimize the graphics pipeline for ultimate responsiveness, providing faster target acquisition, quicker reaction times, and improved aim precision in competitive games. Reflex 2 introduces Frame Warp (coming soon!), which further reduces latency based on the game’s latest mouse input.', 'RTX AI PCs - NVIDIA Powers the World’s AI. And Yours. Upgrade to advanced AI with NVIDIA GeForce RTX GPUs and accelerate your gaming, creating, productivity, and development. Thanks to built-in AI processors, you get world-leading AI technology powering your Windows PC.', 'Creators - Your Creative AI-dvantage. NVIDIA Studio is your creative advantage. GeForce RTX 50 Series GPUs unlock transformative performance in video editing, 3D rendering, and graphic design. Experience RTX accelerations in top creative apps, world-class NVIDIA Studio drivers engineered and continually updated to provide maximum stability, and a suite of exclusive tools that harness the power of RTX for AI-assisted creative workflows.']",https://m.media-amazon.com/images/I/61lmZjZXotL._AC_SX679_.jpg,4.2
https://www.amazon.com/XIDAX-X6-ONAMI-Gaming-Assembled/dp/B0FD4WHXV1/ref=sr_1_82?dib=eyJ2IjoiMSJ9.DzoufdesyCmZjDVd9SKcvLZ1s52x8YvSGa_Zc7amGGNOECFTLefWZbZ_tF2qRlE4k0r80XLeyR06lJdvbY1BkFgiwAEC9xIUiCQPFeI-KeRsF6tOl9yexHkOkDbaF9i47BhPAxeQOErDdDgUASLsa8obowtX1Ps8TLrsu95XO3czLWTPPvcxZUk9YKzVBwzW9_GtFSlvYAB-9acYOF3KUoCUklFjNvgT4FevoNYZ-2E.vS_0fmnCV0aJi5KDYjb5u4DhYq8HUhDaGiwOJEbELSQ&dib_tag=se&keywords=NVIDIA+RTX+5090&qid=1756534341&sr=8-82,XIDAX X6 ONAMI Gaming PC - AMD Ryzen 7 9800X3D (up to 5.2 GHz) | NVIDIA GeForce RTX 5090 32GB | 64GB (2x32GB) DDR5 6000MHz | 2TB NVme M.2 SSD | Genuine Windows 11 Home | Assembled & Serviced in U.S.,"4,899","['ELITE PERFORMANCE: AMD Ryzen 9 9800X3D processor delivers exceptional gaming performance with advanced 3D V-Cache technology for ultra-smooth gameplay.', 'GRAPHICS POWERHOUSE: RTX 5090 graphics card enables stunning 4K gaming and VR experiences with revolutionary ray-tracing capabilities.', 'HIGH-SPEED MEMORY: 64GB DDR5 RAM at 6000MHz with RGB lighting ensures seamless multitasking and rapid data access for demanding applications.', 'STORAGE SOLUTION: 2TB NVMe SSD provides lightning-fast load times and ample space for your gaming library and content creation needs.', 'RELIABLE POWER: 1000W power supply unit delivers stable, efficient power distribution for high-performance components with future upgrade potential.', 'AI Ready & VR Ready: Built for creators, demanding workloads, and gaming, with the power to run advanced AI applications and deliver smooth, immersive VR experiences.']",https://m.media-amazon.com/images/I/71VgsN2aVrL._AC_SX679_.jpg,N/A
https://www.amazon.com/Skytech-Gaming-Desktop-9800X3D-NVIDIA/dp/B0F93WFKS2/ref=sr_1_83?dib=eyJ2IjoiMSJ9.DzoufdesyCmZjDVd9SKcvLZ1s52x8YvSGa_Zc7amGGNOECFTLefWZbZ_tF2qRlE4k0r80XLeyR06lJdvbY1BkFgiwAEC9xIUiCQPFeI-KeRsF6tOl9yexHkOkDbaF9i47BhPAxeQOErDdDgUASLsa8obowtX1Ps8TLrsu95XO3czLWTPPvcxZUk9YKzVBwzW9_GtFSlvYAB-9acYOF3KUoCUklFjNvgT4FevoNYZ-2E.vS_0fmnCV0aJi5KDYjb5u4DhYq8HUhDaGiwOJEbELSQ&dib_tag=se&keywords=NVIDIA+RTX+5090&qid=1756534341&sr=8-83,"Skytech Prism 4 Gaming PC Desktop, Ryzen 7 9800X3D 4.7 GHz (5.2 GHz Turbo), NVIDIA RTX 5090 32GB, X870 Board, 2TB Gen4 NVMe SSD, 64GB DDR5 RAM 6000 RGB, 1200W Gold ATX 3 PSU, Wi-Fi, Win 11","4,799","['AMD Ryzen 7 9800X3D 4.7GHz (5.2GHz Turbo Boost) CPU Processor | 2TB Gen4 NVMe M.2 SSD – Up to 30x Faster Than Traditional HDD | 360mm AIO Liquid CPU Cooler with ARGB Fans, say goodbye to outdated and inefficient air coolers.', 'NVIDIA Geforce RTX 5090 32GB GDDR7 Graphics Card (Brand may vary) | X870 motherboard delivers exceptional gaming and professional experiences.| 64GB DDR5 RAM 6000 RGB Gaming Memory with Heat Spreader | Windows 11 Home 64-bit', '802.11 AC | No Bloatware | Graphic output options include 1 x HDMI, and 1 x Display Port Promised, Additional Ports may vary | USB Ports Including 2.0, 3.0, and 3.2 Gen1 Ports | HD Audio & Mic | Free Gaming Keyboard & Mouse', ""High-spec AIO liquid coolers used, delivering unmatched cooling performance for a perfect operational experience and unparalleled cooling performance. With hardware unrestricted by temperature limits, you can unleash its full potential. Whether gaming, creating, or working, you'll never suffer from thermal throttling again. | Showcase Your PC with the Stunning Prism 4 C8 Wood Curve Case - Black | 1 Year Warranty on Parts and Labor | Free Technical Support | Assembled in the USA"", 'This powerful gaming PC is capable of running all your favorite games such as Call of Duty, Fortnite, Escape from Tarkov, Grand Theft Auto V, Valorant, World of Warcraft, League of Legends, Apex Legends, PLAYERUNKNOWN’s Battlegrounds, Overwatch 2, Counter-Strike 2, Battlefield V, Minecraft, ELDEN RING Shadow of the Erdtree, Rocket League, Baldur’s Gate 3, Dota 2, HELLDIVERS 2, Monster Hunter, Terraria, Rainbow Six Siege, Dragon’s Dogma 2, Black Myth Wukong, Marvel Rivals, more at Ultra settings, detailed 4K Ultra HD resolution, and smooth 60+ FPS gameplay.']",https://m.media-amazon.com/images/I/71Hh24R0vgL._AC_SX679_.jpg,5.0
https://www.amazon.com/PNY-GeForce-RTXTM-5080-Triple/dp/B0DYRZZJZ1/ref=sr_1_84?dib=eyJ2IjoiMSJ9.DzoufdesyCmZjDVd9SKcvLZ1s52x8YvSGa_Zc7amGGNOECFTLefWZbZ_tF2qRlE4k0r80XLeyR06lJdvbY1BkFgiwAEC9xIUiCQPFeI-KeRsF6tOl9yexHkOkDbaF9i47BhPAxeQOErDdDgUASLsa8obowtX1Ps8TLrsu95XO3czLWTPPvcxZUk9YKzVBwzW9_GtFSlvYAB-9acYOF3KUoCUklFjNvgT4FevoNYZ-2E.vS_0fmnCV0aJi5KDYjb5u4DhYq8HUhDaGiwOJEbELSQ&dib_tag=se&keywords=NVIDIA+RTX+5090&qid=1756534341&sr=8-84,PNY GeForce RTX™ 5080 Triple Fan,"1,087","['DLSS is a revolutionary suite of neural rendering technologies that uses AI to boost FPS, reduce latency, and improve image quality.', 'Fifth-Gen Tensor Cores, New Streaming Multiprocessors, Fourth-Gen Ray Tracing Cores', 'Reflex technologies optimize the graphics pipeline for ultimate responsiveness, providing faster target acquisition, quicker reaction times, and improved aim precision in competitive games.', 'Upgrade to advanced AI with NVIDIA GeForce RTX GPUs and accelerate your gaming, creating, productivity, and development. Thanks to built-in AI processors, you get world-leading AI technology powering your Windows PC.', 'Experience RTX accelerations in top creative apps, world-class NVIDIA Studio drivers engineered and continually updated to provide maximum stability, and a suite of exclusive tools that harness the power of RTX for AI-assisted creative workflows.']",https://m.media-amazon.com/images/I/71oOraaImGL._AC_SX679_.jpg,4.1
https://www.amazon.com/GIGABYTE-WINDFORCE-Graphics-GV-N506TWF2MAX-OC-16GD/dp/B0FFQ8P2HK/ref=sr_1_85?dib=eyJ2IjoiMSJ9.DzoufdesyCmZjDVd9SKcvLZ1s52x8YvSGa_Zc7amGGNOECFTLefWZbZ_tF2qRlE4k0r80XLeyR06lJdvbY1BkFgiwAEC9xIUiCQPFeI-KeRsF6tOl9yexHkOkDbaF9i47BhPAxeQOErDdDgUASLsa8obowtX1Ps8TLrsu95XO3czLWTPPvcxZUk9YKzVBwzW9_GtFSlvYAB-9acYOF3KUoCUklFjNvgT4FevoNYZ-2E.vS_0fmnCV0aJi5KDYjb5u4DhYq8HUhDaGiwOJEbELSQ&dib_tag=se&keywords=NVIDIA+RTX+5090&qid=1756534341&sr=8-85,"GIGABYTE GeForce RTX 5060 Ti WINDFORCE MAX OC 16G Graphics Card, 16GB 128-bit GDDR7, PCIe 5.0, WINDFORCE Cooling System, GV-N506TWF2MAX OC-16GD Video Card",449,"['Powered by the NVIDIA Blackwell architecture and DLSS 4', 'Powered by GeForce RTX 5060 Ti', 'Integrated with 16GB GDDR7 128bit memory interface', 'PCIe 5.0', 'WINDFORCE cooling system', 'Hawk fan', 'Server-grade Thermal conductive gel', 'Reinforced structure']",https://m.media-amazon.com/images/I/71-T6fe9-PL._AC_SX679_.jpg,4.7
https://www.amazon.com/Lenovo-Legion-Model-Gaming-Laptop/dp/B0DXXY2B4V/ref=sr_1_86?dib=eyJ2IjoiMSJ9.DzoufdesyCmZjDVd9SKcvLZ1s52x8YvSGa_Zc7amGGNOECFTLefWZbZ_tF2qRlE4k0r80XLeyR06lJdvbY1BkFgiwAEC9xIUiCQPFeI-KeRsF6tOl9yexHkOkDbaF9i47BhPAxeQOErDdDgUASLsa8obowtX1Ps8TLrsu95XO3czLWTPPvcxZUk9YKzVBwzW9_GtFSlvYAB-9acYOF3KUoCUklFjNvgT4FevoNYZ-2E.vS_0fmnCV0aJi5KDYjb5u4DhYq8HUhDaGiwOJEbELSQ&dib_tag=se&keywords=NVIDIA+RTX+5090&qid=1756534341&sr=8-86,"Lenovo Legion Pro 7i Gen 10 (2025 Model) Gaming Laptop, 16"" OLED 16:10 2.5K 500nits 240Hz, NVIDIA® GeForce RTX™ RTX 5090, Intel Core Ultra 9 275HX, 32GB DDR5-6400, 1TB SSD, Wi-Fi 7, Per-Key RGB","3,579","['NVIDIA GeForce RTX 5090 Graphics', 'Intel Core Ultra 9 275HX Tetracosa-core', '16"" OLED Glossy 240Hz WQXGA Display', '32 GB DDR5 Memory', '1 TB M.2 TLC SSD']",https://m.media-amazon.com/images/I/81cGS82CFCL._AC_SX679_.jpg,5.0
https://www.amazon.com/GIGABYTE-Graphics-WINDFORCE-GV-N5070AERO-OC-12GD/dp/B0DTR54HZZ/ref=sr_1_87?dib=eyJ2IjoiMSJ9.DzoufdesyCmZjDVd9SKcvLZ1s52x8YvSGa_Zc7amGGNOECFTLefWZbZ_tF2qRlE4k0r80XLeyR06lJdvbY1BkFgiwAEC9xIUiCQPFeI-KeRsF6tOl9yexHkOkDbaF9i47BhPAxeQOErDdDgUASLsa8obowtX1Ps8TLrsu95XO3czLWTPPvcxZUk9YKzVBwzW9_GtFSlvYAB-9acYOF3KUoCUklFjNvgT4FevoNYZ-2E.vS_0fmnCV0aJi5KDYjb5u4DhYq8HUhDaGiwOJEbELSQ&dib_tag=se&keywords=NVIDIA+RTX+5090&qid=1756534341&sr=8-87,"GIGABYTE GeForce RTX 5070 AERO OC 12G Graphics Card, 12GB 192-bit GDDR7, PCIe 5.0, WINDFORCE Cooling System, GV-N5070AERO OC-12GD Video Card",673,"['Powered by the NVIDIA Blackwell architecture and DLSS 4', 'Powered by GeForce RTX 5070', 'Integrated with 12GB GDDR7 192bit memory interface', 'PCIe 5.0', 'WINDFORCE cooling system']",https://m.media-amazon.com/images/I/714QtozQg9L._AC_SX679_.jpg,4.8
https://www.amazon.com/PNY-NVIDIA-RTX-6000-ADA/dp/B0BNYR4VX8/ref=sr_1_88?dib=eyJ2IjoiMSJ9.DzoufdesyCmZjDVd9SKcvLZ1s52x8YvSGa_Zc7amGGNOECFTLefWZbZ_tF2qRlE4k0r80XLeyR06lJdvbY1BkFgiwAEC9xIUiCQPFeI-KeRsF6tOl9yexHkOkDbaF9i47BhPAxeQOErDdDgUASLsa8obowtX1Ps8TLrsu95XO3czLWTPPvcxZUk9YKzVBwzW9_GtFSlvYAB-9acYOF3KUoCUklFjNvgT4FevoNYZ-2E.vS_0fmnCV0aJi5KDYjb5u4DhYq8HUhDaGiwOJEbELSQ&dib_tag=se&keywords=NVIDIA+RTX+5090&qid=1756534341&sr=8-88,PNY NVIDIA RTX 6000 ADA,"7,159",['VCNRTX6000ADA-PB'],https://m.media-amazon.com/images/I/61I-uAU9XGL._AC_SX679_.jpg,5.0
https://www.amazon.com/HP-Gaming-Desktop-NVIDIA-Portable/dp/B0FGQ4WH2L/ref=sr_1_89?dib=eyJ2IjoiMSJ9.DzoufdesyCmZjDVd9SKcvLZ1s52x8YvSGa_Zc7amGGNOECFTLefWZbZ_tF2qRlE4k0r80XLeyR06lJdvbY1BkFgiwAEC9xIUiCQPFeI-KeRsF6tOl9yexHkOkDbaF9i47BhPAxeQOErDdDgUASLsa8obowtX1Ps8TLrsu95XO3czLWTPPvcxZUk9YKzVBwzW9_GtFSlvYAB-9acYOF3KUoCUklFjNvgT4FevoNYZ-2E.vS_0fmnCV0aJi5KDYjb5u4DhYq8HUhDaGiwOJEbELSQ&dib_tag=se&keywords=NVIDIA+RTX+5090&qid=1756534341&sr=8-89,"HP OMEN 45L GT22 RTX 5090 Pro Gaming Desktop, Intel Ultra 9 285K, NVIDIA RTX 5090, 64GB DDR5 RAM, 2TB SSD, RGB Light Studio & Gaming Hub, W11P, Bundle with Lexar SL660 512GB Portable SSD","4,999","['[Massive Memory, Lightning Fast] Featuring a 64GB DDR5 UDIMM for seamless multitasking across various apps and browser sessions; coupled with a 2TB PCIe M.2 SSD for quick boot times and speedy data access.', '[Blazing Speed and Powerful Efficiency] Intel Core Ultra 9 285K (24 Cores, 24 Threads, 36MB L3 Cache, 3.2GHz base frequency, up to 5.7GHz max turbo frequency), with NVIDIA GeForce RTX 5090', '[Comprehensive Connectivity] 4x USB Type-A 5Gbps signaling rate, 6x USB 2.0 Type-A, 1x headphone/microphone combo, 1x microphone, 1x Thunderbolt 4 with USB Type-C 40Gbps signaling rate (DisplayPort 2.1), 1x USB Type-C 10Gbps signaling rate, 1x 3.5 mm audio jack, 1x RJ-45, 1x HDMI, 3x DisplayPort, Wi-Fi 6 & Bluetooth', '[Stay Secure, Be Productive] Windows 11 Pro - Organize open apps with pre-configured layouts to optimize productivity, Navigate with more intuitive experience to get things done, Collaborate with teams with more features', '[Comprehensive Productivity Bundle] This computer is bundle with a LEXAR LSL660X512G-RNNNG external hard disk, offering a high-capacity storage solution that enhances data management and transfer speeds.', ""[Professional Upgrade] The original seal has been opened solely for upgrading purposes. A 1-year warranty on the upgraded RAM/SSD is provided by PCOnline US, while the remaining components retain the original 1-year manufacturer's warranty""]",https://m.media-amazon.com/images/I/61I4L75lvRL._AC_SX679_.jpg,N/A
https://www.amazon.com/GIGABYTE-GeForce-WINDFORCE-Graphics-GV-N5060WF2-8GD/dp/B0F8LPDVPQ/ref=sr_1_90?dib=eyJ2IjoiMSJ9.DzoufdesyCmZjDVd9SKcvLZ1s52x8YvSGa_Zc7amGGNOECFTLefWZbZ_tF2qRlE4k0r80XLeyR06lJdvbY1BkFgiwAEC9xIUiCQPFeI-KeRsF6tOl9yexHkOkDbaF9i47BhPAxeQOErDdDgUASLsa8obowtX1Ps8TLrsu95XO3czLWTPPvcxZUk9YKzVBwzW9_GtFSlvYAB-9acYOF3KUoCUklFjNvgT4FevoNYZ-2E.vS_0fmnCV0aJi5KDYjb5u4DhYq8HUhDaGiwOJEbELSQ&dib_tag=se&keywords=NVIDIA+RTX+5090&qid=1756534341&sr=8-90,"GIGABYTE GeForce RTX 5060 WINDFORCE 8G Graphics Card, 8GB 128-bit GDDR7, PCIe 5.0, WINDFORCE Cooling System, GV-N5060WF2-8GD Video Card",299,"['Powered by the NVIDIA Blackwell architecture and DLSS 4', 'Powered by GeForce RTX 5060', 'Integrated with 8GB GDDR7 128bit memory interface', 'PCIe 5.0', 'WINDFORCE cooling system']",https://m.media-amazon.com/images/I/71Bf6WIDGvL._AC_SX679_.jpg,4.7
https://www.amazon.com/HP-Gaming-Desktop-NVIDIA-Portable/dp/B0FGQ6CDRB/ref=sr_1_91?dib=eyJ2IjoiMSJ9.DzoufdesyCmZjDVd9SKcvLZ1s52x8YvSGa_Zc7amGGNOECFTLefWZbZ_tF2qRlE4k0r80XLeyR06lJdvbY1BkFgiwAEC9xIUiCQPFeI-KeRsF6tOl9yexHkOkDbaF9i47BhPAxeQOErDdDgUASLsa8obowtX1Ps8TLrsu95XO3czLWTPPvcxZUk9YKzVBwzW9_GtFSlvYAB-9acYOF3KUoCUklFjNvgT4FevoNYZ-2E.vS_0fmnCV0aJi5KDYjb5u4DhYq8HUhDaGiwOJEbELSQ&dib_tag=se&keywords=NVIDIA+RTX+5090&qid=1756534341&sr=8-91,"HP OMEN 45L GT22 RTX 5090 Gaming Desktop, Intel Ultra 9 285K, NVIDIA RTX 5090, 32GB DDR5 RAM, 2TB SSD, RGB Light Studio & Gaming Hub,Wi-Fi 6, W11H, Bundle with Lexar SL660 512GB Portable SSD","4,899","['[Massive Memory, Lightning Fast] Featuring a 32GB DDR5 UDIMM for seamless multitasking across various apps and browser sessions; coupled with a 2TB PCIe M.2 SSD for quick boot times and speedy data access.', '[Blazing Speed and Powerful Efficiency] Intel Core Ultra 9 285K (24 Cores, 24 Threads, 36MB L3 Cache, 3.2GHz base frequency, up to 5.7GHz max turbo frequency), with NVIDIA GeForce RTX 5090', '[Comprehensive Connectivity] 4x USB Type-A 5Gbps signaling rate, 6x USB 2.0 Type-A, 1x headphone/microphone combo, 1x microphone, 1x Thunderbolt 4 with USB Type-C 40Gbps signaling rate (DisplayPort 2.1), 1x USB Type-C 10Gbps signaling rate, 1x 3.5 mm audio jack, 1x RJ-45, 1x HDMI, 3x DisplayPort, Wi-Fi 6 & Bluetooth', '[Stay Secure, Be Productive] Windows 11 Home - Beautiful, more consistent new design, Great window layout options, Better multi-monitor functionality, Improved performance features, New videogame selection and capabilities, Compatible with Android Apps', '[Comprehensive Productivity Bundle] This computer is bundle with a LEXAR LSL660X512G-RNNNG external hard disk, offering a high-capacity storage solution that enhances data management and transfer speeds.', ""[Professional Upgrade] The original seal has been opened solely for upgrading purposes. A 1-year warranty on the upgraded RAM/SSD is provided by PCOnline US, while the remaining components retain the original 1-year manufacturer's warranty""]",https://m.media-amazon.com/images/I/61E+MarNubL._AC_SX679_.jpg,5.0
https://www.amazon.com/MSI-Graphics-256-bit-Extreme-Performance/dp/B0DSWR8WMB/ref=sr_1_92?dib=eyJ2IjoiMSJ9.DzoufdesyCmZjDVd9SKcvLZ1s52x8YvSGa_Zc7amGGNOECFTLefWZbZ_tF2qRlE4k0r80XLeyR06lJdvbY1BkFgiwAEC9xIUiCQPFeI-KeRsF6tOl9yexHkOkDbaF9i47BhPAxeQOErDdDgUASLsa8obowtX1Ps8TLrsu95XO3czLWTPPvcxZUk9YKzVBwzW9_GtFSlvYAB-9acYOF3KUoCUklFjNvgT4FevoNYZ-2E.vS_0fmnCV0aJi5KDYjb5u4DhYq8HUhDaGiwOJEbELSQ&dib_tag=se&keywords=NVIDIA+RTX+5090&qid=1756534341&sr=8-92,"MSI Gaming RTX 5080 16G SUPRIM Liquid SOC Graphics Card (16GB GDDR7, 256-bit, Extreme Performance: 2760 MHz, DisplayPort x 3 2.1a, HDMI 2.1b, NVIDIA Blackwell Architecture)","1,469","['Chipset: NVIDIA GeForce RTX 5080', 'Video Memory: 16 GB GDDR7', 'Memory Interface: 256-bit', 'Output: DisplayPort x 3 (v2.1a) / HDMI 2.1b x 1', 'Digital maximum resolution: 7680 x 4320']",https://m.media-amazon.com/images/I/71b5WDWZfsL._AC_SX679_.jpg,4.3
https://www.amazon.com/NVIDIA-Titan-RTX-Graphics-Card/dp/B07L8YGDL5/ref=sr_1_93?dib=eyJ2IjoiMSJ9.DzoufdesyCmZjDVd9SKcvLZ1s52x8YvSGa_Zc7amGGNOECFTLefWZbZ_tF2qRlE4k0r80XLeyR06lJdvbY1BkFgiwAEC9xIUiCQPFeI-KeRsF6tOl9yexHkOkDbaF9i47BhPAxeQOErDdDgUASLsa8obowtX1Ps8TLrsu95XO3czLWTPPvcxZUk9YKzVBwzW9_GtFSlvYAB-9acYOF3KUoCUklFjNvgT4FevoNYZ-2E.vS_0fmnCV0aJi5KDYjb5u4DhYq8HUhDaGiwOJEbELSQ&dib_tag=se&keywords=NVIDIA+RTX+5090&qid=1756534341&sr=8-93,NVIDIA Titan RTX 24GB gddr6 Graphics Card,"1,239","['OS Certification : Windows 7 (64 bit), Windows 10 (64 bit) (April 2018 Update or later), Linux 64 bit', '4608 NVIDIA CUDA cores running at 1770 MegaHertZ boost clock; NVIDIA Turing architecture', 'New 72 RT cores for acceleration of ray tracing', '576 Tensor Cores for AI acceleration; Recommended power supply 650 watts', '24 GB of GDDR6 memory running at 14 Gigabits per second for up to 672 GB/s of memory bandwidth']",https://m.media-amazon.com/images/I/71OpiCVK+0L._AC_SX679_.jpg,4.3
https://www.amazon.com/PNY-GeForce-RTXTM-4090-Triple-Graphics/dp/B0BHBTJ2X2/ref=sr_1_94?dib=eyJ2IjoiMSJ9.DzoufdesyCmZjDVd9SKcvLZ1s52x8YvSGa_Zc7amGGNOECFTLefWZbZ_tF2qRlE4k0r80XLeyR06lJdvbY1BkFgiwAEC9xIUiCQPFeI-KeRsF6tOl9yexHkOkDbaF9i47BhPAxeQOErDdDgUASLsa8obowtX1Ps8TLrsu95XO3czLWTPPvcxZUk9YKzVBwzW9_GtFSlvYAB-9acYOF3KUoCUklFjNvgT4FevoNYZ-2E.vS_0fmnCV0aJi5KDYjb5u4DhYq8HUhDaGiwOJEbELSQ&dib_tag=se&keywords=NVIDIA+RTX+5090&qid=1756534341&sr=8-94,"PNY GeForce RTX™ 4090 24GB Verto™ Triple Fan Graphics Card DLSS 3 (384-bit PCIe 4.0, GDDR6X, Supports 4k, Anti-Sag Bracket, HDMI/DisplayPort)","2,899","['Powered by NVIDIA DLSS 3, ultra-efficient Ada Lovelace arch, and full ray tracing', 'NVIDIA Ada Lovelace, with 2235MHz core clock and 2520MHz boost clock speeds to help meet the needs of demanding games.', '24GB GDDR6X (384-bit) on-board memory, plus 16384 CUDA processing cores and up to 1008GB/sec of memory bandwidth provide the memory needed to create striking visual realism.', 'PCI Express 4.0 interface - Offers compatibility with a range of systems. Also includes DisplayPort and HDMI outputs for expanded connectivity.', ""NVIDIA GeForce Experience - Capture and share videos, screenshots, and livestreams with friends. Keep your drivers up to date and optimize your game settings. It's the essential companion to your GeForce graphics card.""]",https://m.media-amazon.com/images/I/619QTa9dXXL._AC_SX679_.jpg,4.6
https://www.amazon.com/ASUS-GeForce-Graphics-DisplayPort-TUF-RTX4090-O24G-GAMING/dp/B0BHD9TS9Q/ref=sr_1_95?dib=eyJ2IjoiMSJ9.DzoufdesyCmZjDVd9SKcvLZ1s52x8YvSGa_Zc7amGGNOECFTLefWZbZ_tF2qRlE4k0r80XLeyR06lJdvbY1BkFgiwAEC9xIUiCQPFeI-KeRsF6tOl9yexHkOkDbaF9i47BhPAxeQOErDdDgUASLsa8obowtX1Ps8TLrsu95XO3czLWTPPvcxZUk9YKzVBwzW9_GtFSlvYAB-9acYOF3KUoCUklFjNvgT4FevoNYZ-2E.vS_0fmnCV0aJi5KDYjb5u4DhYq8HUhDaGiwOJEbELSQ&dib_tag=se&keywords=NVIDIA+RTX+5090&qid=1756534341&sr=8-95,"Asus TUF Gaming NVIDIA GeForce RTX 4090 OC Edition Gaming Graphics Card (24GB GDDR6X, PCIe 4.0, HDMI 2.1a, DisplayPort 1.4a, Dual Ball Bearing Axial Fans)","3,149","['NVIDIA Ada Lovelace Streaming Multiprocessors: Up to 2x performance and energy efficiency', 'Tensor Cores of the 4th Generation: up to 2x AI performance', 'RT-cores of the 3rd Generation: up to 2x raytracing performance', 'OC mode: Boost clock 2595 MHz (OC mode) / 2565 MHz (gaming mode)', 'Axial Tech fans deliver up to 23% higher airflow']",https://m.media-amazon.com/images/I/81SmwFXiirL._AC_SX679_.jpg,4.3
https://www.amazon.com/PNY-VCQRTX6000-PB-Quadro-6000-Graphic/dp/B07HY86LMV/ref=sr_1_96?dib=eyJ2IjoiMSJ9.DzoufdesyCmZjDVd9SKcvLZ1s52x8YvSGa_Zc7amGGNOECFTLefWZbZ_tF2qRlE4k0r80XLeyR06lJdvbY1BkFgiwAEC9xIUiCQPFeI-KeRsF6tOl9yexHkOkDbaF9i47BhPAxeQOErDdDgUASLsa8obowtX1Ps8TLrsu95XO3czLWTPPvcxZUk9YKzVBwzW9_GtFSlvYAB-9acYOF3KUoCUklFjNvgT4FevoNYZ-2E.vS_0fmnCV0aJi5KDYjb5u4DhYq8HUhDaGiwOJEbELSQ&dib_tag=se&keywords=NVIDIA+RTX+5090&qid=1756534341&sr=8-96,NVIDIA Quadro RTX 6000,"1,039","['CUDA Cores: 4608 / NVIDIA Tensor Cores: 576 / NVIDIA RT Cores: 72', 'GPU Memory: 24 GB GDDR6 with ECC / Bandwidth: 624 GB/Sec', 'System Interface: PCI Express 3.0 x16', 'Four DisplayPort 1.4 Connectors', '3D Stereo Support with Stereo Connector']",https://m.media-amazon.com/images/I/41JfC7adkYL._AC_SX679_.jpg,4.3
https://www.amazon.com/NVIDIA-Titan-Graphics-Card-Renewed/dp/B07RX4DBGH/ref=sr_1_97?dib=eyJ2IjoiMSJ9.DzoufdesyCmZjDVd9SKcvLZ1s52x8YvSGa_Zc7amGGNOECFTLefWZbZ_tF2qRlE4k0r80XLeyR06lJdvbY1BkFgiwAEC9xIUiCQPFeI-KeRsF6tOl9yexHkOkDbaF9i47BhPAxeQOErDdDgUASLsa8obowtX1Ps8TLrsu95XO3czLWTPPvcxZUk9YKzVBwzW9_GtFSlvYAB-9acYOF3KUoCUklFjNvgT4FevoNYZ-2E.vS_0fmnCV0aJi5KDYjb5u4DhYq8HUhDaGiwOJEbELSQ&dib_tag=se&keywords=NVIDIA+RTX+5090&qid=1756534341&sr=8-97,NVIDIA Titan RTX Graphics Card (Renewed),799,"['OS Certification-Windows 7 64-bit, Windows 10 64-bit (April 2018 Update or later),Linux 64-bit', '4608 NVIDIA CUDA cores running at 1770 MHz boost clock. NVIDIA Turing architecture', 'New 72 RT cores for acceleration of ray-tracing', '576 Tensor Cores for AI acceleration']",https://m.media-amazon.com/images/I/71NZsi4K9rL._AC_SX679_.jpg,3.0
https://www.amazon.com/sspa/click?ie=UTF8&spc=MToxOTg3OTY5ODIzMTkwOTE6MTc1NjUzNDM5MDpzcF9hdGZfbmV4dDozMDA4MzQyNzYxODE1MDI6OjA6Og&url=%2FPNY-Overclocked-Graphics-3-5-Slot-Epic-XTM%2Fdp%2FB0DTJFSSZG%2Fref%3Dsr_1_97_sspa%3Fdib%3DeyJ2IjoiMSJ9.uB7YsepZg5UfQT5ed_dxO6Jjr_aW4AS_O2qXmaR94xksEqPnXE2yTb__PAnX4qLzHPn0ULtVS-fBOnz5MOw_nVDzIRCZF4dI2lwsPPWbxghfAQ7HoMIToV5JLj94tWnG1umCU4axXm5nRp8FHPBMj3dg801AJ7sSXBpAG2rT4ekll-RovPGZL7_k-bp8qeDNDy16T2W1pLgteNE4g2aupBl7XAKezw6PFEuv2pLvGT0.LsRVWpqmh4ZrvMZ2XJISwZAODggUQyqubZfSXcOttUM%26dib_tag%3Dse%26keywords%3DNVIDIA%2BRTX%2B5090%26qid%3D1756534390%26sr%3D8-97-spons%26sp_csd%3Dd2lkZ2V0TmFtZT1zcF9hdGZfbmV4dA%26psc%3D1,"PNY NVIDIA GeForce RTX™ 5090 32GB ARGB Overclocked Triple Fan Graphics Card (DLSS 4, PCIe® 5.0, HDMI®/DP 2.1, 3.5-Slot, Epic-X™ RGB Lighting)","2,517","['NVIDIA DLSS 4 - Supreme Speed. Superior Visuals. Powered by AI. DLSS is a revolutionary suite of neural rendering technologies that uses AI to boost FPS, reduce latency, and improve image quality. \u200cThe latest breakthrough, DLSS 4, brings new Multi Frame Generation and enhanced Ray Reconstruction and Super Resolution, powered by GeForce RTX 50 Series GPUs and fifth-generation Tensor Cores. DLSS on GeForce RTX is the best way to play, backed by an NVIDIA AI supercomputer in the cloud constantly improving your PC’s gaming capabilities.', 'NVIDIA Reflex 2 - Compete at Warp Speed. Reflex technologies optimize the graphics pipeline for ultimate responsiveness, providing faster target acquisition, quicker reaction times, and improved aim precision in competitive games. Reflex 2 introduces Frame Warp (coming soon!), which further reduces latency based on the game’s latest mouse input.', 'RTX AI PCs - NVIDIA Powers the World’s AI. And Yours. Upgrade to advanced AI with NVIDIA GeForce RTX GPUs and accelerate your gaming, creating, productivity, and development. Thanks to built-in AI processors, you get world-leading AI technology powering your Windows PC.', 'Creators - Your Creative AI-dvantage. NVIDIA Studio is your creative advantage. GeForce RTX 50 Series GPUs unlock transformative performance in video editing, 3D rendering, and graphic design. Experience RTX accelerations in top creative apps, world-class NVIDIA Studio drivers engineered and continually updated to provide maximum stability, and a suite of exclusive tools that harness the power of RTX for AI-assisted creative workflows.']",https://m.media-amazon.com/images/I/61lmZjZXotL._AC_SX679_.jpg,4.2
https://www.amazon.com/GIGABYTE-GeForce-WINDFORCE-Graphics-GV-N5060WF2-8GD/dp/B0F8LPDVPQ/ref=sr_1_98?dib=eyJ2IjoiMSJ9.uB7YsepZg5UfQT5ed_dxO6Jjr_aW4AS_O2qXmaR94xksEqPnXE2yTb__PAnX4qLzHPn0ULtVS-fBOnz5MOw_nVDzIRCZF4dI2lwsPPWbxghfAQ7HoMIToV5JLj94tWnG1umCU4axXm5nRp8FHPBMj3dg801AJ7sSXBpAG2rT4ekll-RovPGZL7_k-bp8qeDNDy16T2W1pLgteNE4g2aupBl7XAKezw6PFEuv2pLvGT0.LsRVWpqmh4ZrvMZ2XJISwZAODggUQyqubZfSXcOttUM&dib_tag=se&keywords=NVIDIA+RTX+5090&qid=1756534390&sr=8-98,"GIGABYTE GeForce RTX 5060 WINDFORCE 8G Graphics Card, 8GB 128-bit GDDR7, PCIe 5.0, WINDFORCE Cooling System, GV-N5060WF2-8GD Video Card",299,"['Powered by the NVIDIA Blackwell architecture and DLSS 4', 'Powered by GeForce RTX 5060', 'Integrated with 8GB GDDR7 128bit memory interface', 'PCIe 5.0', 'WINDFORCE cooling system']",https://m.media-amazon.com/images/I/71Bf6WIDGvL.__AC_SX300_SY300_QL70_FMwebp_.jpg,4.7
